Place of Interest,Type of place,Place address,BiciMAD station,Station locaiton,Available bikes
Si todos los hombres...,Monuments,CALLE GUZMAN EL BUENO 1,123 - Guzmán el Bueno,Calle Guzmán el Bueno nº 1,7
El Pueblo Español tiene un camino que conduce a una estrella,Monuments,C Sánchez Bustillo ,50 - Museo Reina Sofía,Calle Santa Isabel nº 57,9
Santiago Ramón y Cajal,Monuments,C Santa Isabel 51,50 - Museo Reina Sofía,Calle Santa Isabel nº 57,9
Mosaicos murales,Monuments,Pza Juan Pujol ,59 - Plaza de Juan Pujol,Calle Espíritu Santo nº 30,17
Pinturas Mingote,Monuments,C de la Sal ,32 - Plaza de la Provincia,Plaza de la Provincia nº 1,5
Adhesión de España a la Comunidad Europea,Monuments,PLAZA PROVINCIA 1,32 - Plaza de la Provincia,Plaza de la Provincia nº 1,5
Santa María de la Cabeza,Monuments,CALLE TOLEDO 1,32 - Plaza de la Provincia,Plaza de la Provincia nº 1,5
Fuente de Orfeo,Monuments,Pza Provincia ,32 - Plaza de la Provincia,Plaza de la Provincia nº 1,5
Planta de la torre de la iglesia de Santa Cruz,Monuments,Pza Santa Cruz 1,32 - Plaza de la Provincia,Plaza de la Provincia nº 1,5
Museo de los Toreros,Monuments,C Alcalá 231,193 - Ventas,Avenida de los Toreros nº 49,9
Inauguración Parque Cuarto Depósito CYII,Monuments,Ctra Castilla 9,209 - Plaza de Castilla 2,Paseo Castellana (Fundación Canal),9
José Calvo Sotelo,Monuments,PLAZA CASTILLA 1,209 - Plaza de Castilla 2,Paseo Castellana (Fundación Canal),9
Fuente Plaza de Castilla,Monuments,PLAZA CASTILLA 1,209 - Plaza de Castilla 2,Paseo Castellana (Fundación Canal),9
Columna de Calatrava,Monuments,PLAZA CASTILLA 1,209 - Plaza de Castilla 2,Paseo Castellana (Fundación Canal),9
Mural Palacio de Congresos,Monuments,AVENIDA GENERAL PERON 1,152 - General Perón 1,Avenida del General Perón frente al nº 4,0
Juan Domingo Perón,Monuments,AVENIDA GENERAL PERON 1,152 - General Perón 1,Avenida del General Perón frente al nº 4,0
Mural El Árbol de la Vida,Monuments,C Marcelo Usera 170,228 - San Delfín,Calle San Delfín nº 9,17
Fuente mural en la calle Marcelo Usera,Monuments,C Manuel Noya ,228 - San Delfín,Calle San Delfín nº 9,17
Fuente octogonal del parque Olof Palme,Monuments, ,228 - San Delfín,Calle San Delfín nº 9,17
Junta Municipal Usera,Monuments,Avda Rafaela Ybarra 41,228 - San Delfín,Calle San Delfín nº 9,17
Traída de aguas al Barrio de Usera,Monuments,C Marcelo Usera 144,228 - San Delfín,Calle San Delfín nº 9,17
Monolito del parque Olof Palme II,Monuments, ,228 - San Delfín,Calle San Delfín nº 9,17
Hombre con niño,Monuments,C Antonio López ,228 - San Delfín,Calle San Delfín nº 9,17
La Paloma de la paz,Monuments,C Baleares ,228 - San Delfín,Calle San Delfín nº 9,17
Monolito parque Olof Palme I,Monuments, ,228 - San Delfín,Calle San Delfín nº 9,17
Fuente del parque de Comillas,Monuments, ,228 - San Delfín,Calle San Delfín nº 9,17
Monolito Rafaela Ybarra,Monuments,Avda Rafaela Ybarra 41,228 - San Delfín,Calle San Delfín nº 9,17
Álvaro de Bazán,Monuments,Pza Villa ,35 - Plaza del Cordón,Plaza del Cordón,10
Fuente de la Cruz Verde,Monuments,Pza Cruz Verde ,35 - Plaza del Cordón,Plaza del Cordón,10
Puerta Cerrada,Monuments,Pza Puerta Cerrada ,35 - Plaza del Cordón,Plaza del Cordón,10
Carlos Lezcano,Monuments,C Rollo 3,35 - Plaza del Cordón,Plaza del Cordón,10
Eugenio d'Ors,Monuments,Pza Cordón 2,35 - Plaza del Cordón,Plaza del Cordón,10
Felipe Picatoste Rodríguez,Monuments,Pza Cordón 3,35 - Plaza del Cordón,Plaza del Cordón,10
Cruz Puerta Cerrada,Monuments,Pza Puerta Cerrada ,35 - Plaza del Cordón,Plaza del Cordón,10
El lector,Monuments,C San Justo ,35 - Plaza del Cordón,Plaza del Cordón,10
Gonzalo Ceballos,Monuments,Pza Cordón 2,35 - Plaza del Cordón,Plaza del Cordón,10
Fuente Jardín Príncipe de Anglona,Monuments, ,35 - Plaza del Cordón,Plaza del Cordón,10
Fuente de taza baja Jardín Príncipe de Anglona,Monuments,Pza Paja ,35 - Plaza del Cordón,Plaza del Cordón,10
Pedro Calderón de la Barca,Monuments,Pza Santa Ana ,52 - Plaza de Santa Ana,Plaza de Santa Ana nº 10,22
Jacinto Benavente,Monuments,CALLE ATOCHA 26,52 - Plaza de Santa Ana,Plaza de Santa Ana nº 10,22
Fundacion de la Falange Española,Monuments,C Príncipe 14,52 - Plaza de Santa Ana,Plaza de Santa Ana nº 10,22
Joaquín Ibarra,Monuments,C Núñez de Arce 11,52 - Plaza de Santa Ana,Plaza de Santa Ana nº 10,22
Federico García Lorca,Monuments,Pza Santa Ana ,52 - Plaza de Santa Ana,Plaza de Santa Ana nº 10,22
José Rizal,Monuments,C Manuel Fernández y González 7,52 - Plaza de Santa Ana,Plaza de Santa Ana nº 10,22
José Zorrilla y Moral,Monuments,C Huertas 17,52 - Plaza de Santa Ana,Plaza de Santa Ana nº 10,22
Gustavo Adolfo Bécquer,Monuments,CALLE HUERTAS 20,52 - Plaza de Santa Ana,Plaza de Santa Ana nº 10,22
Luis de Góngora y Argote,Monuments,C Huertas 16,52 - Plaza de Santa Ana,Plaza de Santa Ana nº 10,22
La Solidaridad,Monuments,C Atocha 43,52 - Plaza de Santa Ana,Plaza de Santa Ana nº 10,22
Eloy Gonzalo 'Cascorro',Monuments,Pza Cascorro ,39 - Plaza de la Cebada,Plaza de la Cebada nº 16 ,20
Fuentecilla del Leal,Monuments,C Toledo ,39 - Plaza de la Cebada,Plaza de la Cebada nº 16 ,20
Vicente Pastor,Monuments,C Embajadores 5,39 - Plaza de la Cebada,Plaza de la Cebada nº 16 ,20
Fuente de la Cebada,Monuments,C Toledo ,39 - Plaza de la Cebada,Plaza de la Cebada nº 16 ,20
Antonio Zozaya,Monuments,Pza General Vara del Rey 14,39 - Plaza de la Cebada,Plaza de la Cebada nº 16 ,20
Felipe III,Monuments,Pza Mayor ,31 - Calle Mayor,Calle Mayor nº 20,0
Luis Muñoz Rivera,Monuments,C Mayor 13,31 - Calle Mayor,Calle Mayor nº 20,0
Héroes del Siete de Julio,Monuments,C Mayor 24,31 - Calle Mayor,Calle Mayor nº 20,0
José María Soler y Guijarro,Monuments,Pza Mayor 27,31 - Calle Mayor,Calle Mayor nº 20,0
Casa de la Panadería,Monuments,Pza Mayor 27,31 - Calle Mayor,Calle Mayor nº 20,0
Casa de la Panadería,Monuments,Pza Mayor 27,31 - Calle Mayor,Calle Mayor nº 20,0
Andrómaca,Monuments,PASEO RECOLETOS 1,86 - Cibeles,Plaza Cibeles,21
Fuente de Apolo,Monuments,Pº Prado ,86 - Cibeles,Plaza Cibeles,21
Fuente de Cibeles,Monuments,Pza Cibeles ,86 - Cibeles,Plaza Cibeles,21
Fuente en cascada antigua Mariblanca,Monuments,Pº Recoletos ,86 - Cibeles,Plaza Cibeles,21
Primera Piedra del Banco España,Monuments,Pº Prado 2,86 - Cibeles,Plaza Cibeles,21
Inauguración del Banco España,Monuments,Pº Prado 2,86 - Cibeles,Plaza Cibeles,21
Obelisco del 2 de Mayo y Caídos por España,Monuments,Pza Lealtad ,86 - Cibeles,Plaza Cibeles,21
Fuente de los Patos,Monuments,Pº Prado ,86 - Cibeles,Plaza Cibeles,21
Fuente del niño o fuente de Finlandia,Monuments,Pº Prado ,86 - Cibeles,Plaza Cibeles,21
Jarrones de la Fuente de los Patos,Monuments,Pº Prado ,86 - Cibeles,Plaza Cibeles,21
Columnas del Paseo del Prado,Monuments,Pº Prado ,86 - Cibeles,Plaza Cibeles,21
Niños con jarrón de Cibeles,Monuments,Pza Cibeles ,86 - Cibeles,Plaza Cibeles,21
Monolito Recoletos,Monuments,Pº Recoletos ,86 - Cibeles,Plaza Cibeles,21
Agustín Lara,Monuments,C Sombrerete 15,44 - Plaza de Nelson Mandela,Calle Mesón de Paredes nº 35,5
Luigi Boccherini,Monuments,C Jesús y María 3,44 - Plaza de Nelson Mandela,Calle Mesón de Paredes nº 35,5
Iglesia San Cayetano,Monuments,C Embajadores 15,44 - Plaza de Nelson Mandela,Calle Mesón de Paredes nº 35,5
Fuente de Cabestreros,Monuments,C Mesón de Paredes ,44 - Plaza de Nelson Mandela,Calle Mesón de Paredes nº 35,5
Gaspar Melchor de Jovellanos,Monuments,C Juanelo 18,44 - Plaza de Nelson Mandela,Calle Mesón de Paredes nº 35,5
Lámina de agua de Cabestreros,Monuments,"Pza Cabestreros, de ",44 - Plaza de Nelson Mandela,Calle Mesón de Paredes nº 35,5
Restos Convento Santa Catalina de Sena,Monuments,"Pza Cabestreros, de ",44 - Plaza de Nelson Mandela,Calle Mesón de Paredes nº 35,5
Ramón Mesonero Romanos,Monuments,CALLE BARCELO 1,54 - Barceló,Calle Barceló nº 7,19
Fama,Monuments,C Barceló ,54 - Barceló,Calle Barceló nº 7,19
Jesús Guridi,Monuments,C Sagasta 12,54 - Barceló,Calle Barceló nº 7,19
Antonio Paso Cano,Monuments,C Apodaca 9,54 - Barceló,Calle Barceló nº 7,19
José  Serrano Simeón,Monuments,C Beneficencia 2,54 - Barceló,Calle Barceló nº 7,19
Reveriano Soutullo,Monuments,C Apodaca 7,54 - Barceló,Calle Barceló nº 7,19
Emilia Pardo Bazán,Monuments,C Princesa ,14 - Ventura Rodríguez,Calle Duque de Liria,0
Duque de Alba y de Berwick,Monuments,C Princesa 20,14 - Ventura Rodríguez,Calle Duque de Liria,0
Reflexiones (Los cubos),Monuments,C Princesa 5,14 - Ventura Rodríguez,Calle Duque de Liria,0
Antonio Mingote,Monuments,Pza Cristino Martos 5,14 - Ventura Rodríguez,Calle Duque de Liria,0
Jean-Jacques Rousseau,Monuments,Pza Salesas ,26 - Plaza de las Salesas,Plaza de las Salesas 7,20
Educación de la Infancia,Monuments,PLAZA SALESAS 1,26 - Plaza de las Salesas,Plaza de las Salesas 7,20
Teniente Jacinto Ruíz Mendoza,Monuments,Pza Rey ,20a - Banco de España A,Calle Alcalá nº 49,0
Lugar de Encuentros II,Monuments,Pza Rey ,20a - Banco de España A,Calle Alcalá nº 49,0
Eduardo Marquina,Monuments,C Barquillo 7,20a - Banco de España A,Calle Alcalá nº 49,0
Fuente en la plaza del Rey,Monuments,Pza Rey ,20a - Banco de España A,Calle Alcalá nº 49,0
Maqueta Centenario de la Gran Vía,Monuments,C Gran Vía 1,20a - Banco de España A,Calle Alcalá nº 49,0
Columnas de la casa de las Siete Chimeneas,Monuments,C Infantas 31,20a - Banco de España A,Calle Alcalá nº 49,0
Tirso de Molina,Monuments,Pza Tirso de Molina ,40 - Conde de Romanones,Plaza del Conde de Romanones nº 9,15
Farolero madrileño,Monuments,C Concepción Jerónima 15,40 - Conde de Romanones,Plaza del Conde de Romanones nº 9,15
Ignacio Zuloaga,Monuments,Pza Gabriel Miró ,37 - Plaza de San Francisco,Plaza de San Francisco nº 5,10
Fuente pilón Vistillas,Monuments,Pza Gabriel Miró ,37 - Plaza de San Francisco,Plaza de San Francisco nº 5,10
Fray Francisco Cabezas,Monuments,Pza San Francisco el Grande 1,37 - Plaza de San Francisco,Plaza de San Francisco nº 5,10
Avenida Reyes Católicos,Monuments,Pza San Francisco el Grande 1,37 - Plaza de San Francisco,Plaza de San Francisco nº 5,10
Centro Tercera Edad,Monuments,C Jerte ,37 - Plaza de San Francisco,Plaza de San Francisco nº 5,10
San Isidro,Monuments, ,37 - Plaza de San Francisco,Plaza de San Francisco nº 5,10
Daoiz y Velarde y Arco de Monteleón,Monuments,Pza Dos de Mayo ,11 - San Andrés,Calle San Andrés nº 18,16
Luis Calvo Sotelo,Monuments,Pza Dos de Mayo ,11 - San Andrés,Calle San Andrés nº 18,16
Daoiz y Velarde,Monuments,Pza Dos de Mayo ,11 - San Andrés,Calle San Andrés nº 18,16
Las Lecturas del Dos de Mayo,Monuments,Pza Dos de Mayo ,11 - San Andrés,Calle San Andrés nº 18,16
Oso y Madroño,Monuments,C Carmen ,1a - Puerta del Sol A,Puerta del Sol nº 1,0
Francisco Alonso,Monuments,CALLE ALCALA 1,1a - Puerta del Sol A,Puerta del Sol nº 1,0
Valle-Inclán. Café de la Montaña,Monuments,C Alcalá 2,1a - Puerta del Sol A,Puerta del Sol nº 1,0
Fuente pilón circular de la plaza de los Carros,Monuments,Pza Carros ,38 - Plaza de los Carros,Carrera de San Francisco nº 1,12
Fuente mural de la plaza de los Carros,Monuments,Pza Carros ,38 - Plaza de los Carros,Carrera de San Francisco nº 1,12
Juan López de Hoyos,Monuments,Pza San Andrés ,38 - Plaza de los Carros,Carrera de San Francisco nº 1,12
Lina Morgan,Monuments,C Don Pedro 4,38 - Plaza de los Carros,Carrera de San Francisco nº 1,12
José López Silva,Monuments,C Cava Baja 42,38 - Plaza de los Carros,Carrera de San Francisco nº 1,12
Hombre Sentado,Monuments,Pza Paja ,38 - Plaza de los Carros,Carrera de San Francisco nº 1,12
Juan Ferreras García,Monuments,Pza San Andrés ,38 - Plaza de los Carros,Carrera de San Francisco nº 1,12
Virgen María,Monuments,PLAZA SAN ANDRES 1,38 - Plaza de los Carros,Carrera de San Francisco nº 1,12
Campana de La Paz,Monuments,Pza San Andrés 1,38 - Plaza de los Carros,Carrera de San Francisco nº 1,12
Fuente de San Antón,Monuments,C Hortaleza ,6 - Colegio Arquitectos,Calle Hortaleza nº 63,0
Juan de Villanueva,Monuments,C Hernán Cortés 15,6 - Colegio Arquitectos,Calle Hortaleza nº 63,0
Academia de Farmacia,Monuments,C Farmacia 9,6 - Colegio Arquitectos,Calle Hortaleza nº 63,0
Eugenio d´Ors Rovira,Monuments,Pº Prado ,27 - Huertas,Calle Jesús nº 1,9
Miguel de Cervantes,Monuments,C Lope de Vega 18,27 - Huertas,Calle Jesús nº 1,9
Fernández Caballero Manuel,Monuments,C Cervantes 34,27 - Huertas,Calle Jesús nº 1,9
Leandro Fernández de Moratín,Monuments,CALLE MORATIN 35,27 - Huertas,Calle Jesús nº 1,9
León Felipe,Monuments,C Huertas 64,27 - Huertas,Calle Jesús nº 1,9
Mateo Inurria,Monuments,CALLE QUEVEDO 5,27 - Huertas,Calle Jesús nº 1,9
Fuente-estanque Paseo del Prado,Monuments,Pº Prado 20,27 - Huertas,Calle Jesús nº 1,9
Organización de Profesionales y Autónomos O.P.A.,Monuments,Pº Prado ,27 - Huertas,Calle Jesús nº 1,9
Fuente Platerías Martínez,Monuments,Pza Platería de Martínez ,27 - Huertas,Calle Jesús nº 1,9
José de Espronceda,Monuments,C Huertas 80,27 - Huertas,Calle Jesús nº 1,9
Mariano José de Larra,Monuments,C Huertas 74,27 - Huertas,Calle Jesús nº 1,9
Leandro Fernández de Moratín,Monuments,CALLE HUERTAS 72,27 - Huertas,Calle Jesús nº 1,9
Nicolás Fernández de Moratín,Monuments,C Huertas 69,27 - Huertas,Calle Jesús nº 1,9
León Felipe,Monuments,C Huertas 58,27 - Huertas,Calle Jesús nº 1,9
Félix Lope de Vega Carpio,Monuments,C Huertas 49,27 - Huertas,Calle Jesús nº 1,9
Sor Marcela de San Félix,Monuments,C Huertas 47,27 - Huertas,Calle Jesús nº 1,9
Lope de Vega,Monuments,C Cervantes 11,27 - Huertas,Calle Jesús nº 1,9
Premio Europa Nostra 2003,Monuments,C Huertas 47,27 - Huertas,Calle Jesús nº 1,9
Escultura en el Consejo Económico y Social,Monuments,C Huertas 73,27 - Huertas,Calle Jesús nº 1,9
Vázquez de Mella,Monuments,Pza Vázquez de Mella ,18 - Plaza de Pedro Zerolo,Plaza de Pedro Zerolo nº 1,0
Mesonero Romanos,Monuments,Pza Vázquez de Mella 7,18 - Plaza de Pedro Zerolo,Plaza de Pedro Zerolo nº 1,0
Lazo Homenaje lucha contra el Sida,Monuments,Pza Vázquez de Mella ,18 - Plaza de Pedro Zerolo,Plaza de Pedro Zerolo nº 1,0
Puerta de Toledo,Monuments,Gta Puerta de Toledo ,45 - Puerta de Toledo,Glorieta de la Puerta de Toledo nº 1,12
Reloj de sol Puerta Toledo,Monuments,Gta Puerta de Toledo ,45 - Puerta de Toledo,Glorieta de la Puerta de Toledo nº 1,12
Real Cerca de Felipe IV,Monuments,Rda Ronda de Segovia ,45 - Puerta de Toledo,Glorieta de la Puerta de Toledo nº 1,12
Pedro Antonio de Alarcón,Monuments,C Atocha 94,42 - Santa Isabel,Calle Atocha nº 95,17
Baltasar Bachero,Monuments,C Salitre 34,42 - Santa Isabel,Calle Atocha nº 95,17
Carnicer Betllé Ramón,Monuments,CALLE SANTA ISABEL 38,42 - Santa Isabel,Calle Atocha nº 95,17
Fernando Fresno,Monuments,C Santa Isabel 28,42 - Santa Isabel,Calle Atocha nº 95,17
Juan Ramón Gómez Pamo,Monuments,C Santa Isabel 28,42 - Santa Isabel,Calle Atocha nº 95,17
Imprenta Juan de la Cuesta,Monuments,C Atocha 87,42 - Santa Isabel,Calle Atocha nº 95,17
Marqués de Valdavia,Monuments,C Atocha 80,42 - Santa Isabel,Calle Atocha nº 95,17
Fuente de Santa Isabel,Monuments,C Santa Isabel 48,42 - Santa Isabel,Calle Atocha nº 95,17
Imprenta Juan de la Cuesta,Monuments,C San Eugenio 7,42 - Santa Isabel,Calle Atocha nº 95,17
Carlos Arniches,Monuments,C Carlos Arniches 31,46 - Ribera de Curtidores,Calle Ribera de Curtidores nº 28,9
Protección a la Infancia,Monuments,Pza Campillo del Mundo Nuevo ,46 - Ribera de Curtidores,Calle Ribera de Curtidores nº 28,9
Artieda y Labiano,Monuments,C Navas de Tolosa 10,22 - Jacometrezo,Calle Jacometrezo nº 3,0
Enrique Carrión,Monuments,C Gran Vía 41,22 - Jacometrezo,Calle Jacometrezo nº 3,0
Rubén Darío,Monuments,CALLE VENERAS 4,22 - Jacometrezo,Calle Jacometrezo nº 3,0
Edificio de la Beneficiencia,Monuments,C Ternera 2,22 - Jacometrezo,Calle Jacometrezo nº 3,0
José María Torrijos,Monuments,C Preciados 30,22 - Jacometrezo,Calle Jacometrezo nº 3,0
Jaime Balmes,Monuments,C Leganitos 5,23 - Santo Domingo,Plaza de Santo Domingo nº 1,23
Tomás Bretón,Monuments,CALLE CAMPOMANES 10,23 - Santo Domingo,Plaza de Santo Domingo nº 1,23
María Teresa Rodríguez del Toro de Bolívar,Monuments,C Fuencarral 2,211 - Desengaño,Calle Desengaño nº 1,23
Fernández Valliciergo Vicente,Monuments,C Ballesta 7,211 - Desengaño,Calle Desengaño nº 1,23
Proalí,Monuments,CALLE FUENCARRAL 1,211 - Desengaño,Calle Desengaño nº 1,23
José María Iparraguirre,Monuments,C Montera 48,211 - Desengaño,Calle Desengaño nº 1,23
José Martí,Monuments,C Desengaño ,211 - Desengaño,Calle Desengaño nº 1,23
Beata Maria Ana de Jesús,Monuments,C Valverde 15,211 - Desengaño,Calle Desengaño nº 1,23
Simón Bolívar y María Teresa del Toro,Monuments,C Gravina 19,58 - Augusto Figueroa,Calle Augusto Figueroa nº 33,0
Enrique Jardiel Poncela,Monuments,C Augusto Figueroa 29,58 - Augusto Figueroa,Calle Augusto Figueroa nº 33,0
Leonardo Torres Quevedo,Monuments,C Válgame Dios 3,58 - Augusto Figueroa,Calle Augusto Figueroa nº 33,0
Eduardo Rosales,Monuments,CALLE LIBERTAD 23,58 - Augusto Figueroa,Calle Augusto Figueroa nº 33,0
Botica de José Ortega Hernández,Monuments,C Montera 17,56 - Plaza del Carmen ,Plaza del Carmen nº 1,0
Pepín Fernández,Monuments,Pza Carmen ,56 - Plaza del Carmen ,Plaza del Carmen nº 1,0
Juan Gris,Monuments,C Carmen 4,56 - Plaza del Carmen ,Plaza del Carmen nº 1,0
Cuerpo de Bomberos,Monuments,C Montera 31,56 - Plaza del Carmen ,Plaza del Carmen nº 1,0
Calderón de la Barca,Monuments,C Mayor 61,9 - Plaza de San Miguel,Plaza de San Miguel nº 9,10
Iglesia San Salvador,Monuments,C Mayor 70,9 - Plaza de San Miguel,Plaza de San Miguel nº 9,10
Ricardo Villa,Monuments,Trav Bringas 1,9 - Plaza de San Miguel,Plaza de San Miguel nº 9,10
Fuente en la calle Espejo,Monuments,C Espejo 8,9 - Plaza de San Miguel,Plaza de San Miguel nº 9,10
Calle de Santiago,Monuments,C Santiago 6,9 - Plaza de San Miguel,Plaza de San Miguel nº 9,10
Calle de Milaneses,Monuments,C Milaneses 1,9 - Plaza de San Miguel,Plaza de San Miguel nº 9,10
Botica de la Reina Madre,Monuments,C Mayor 59,9 - Plaza de San Miguel,Plaza de San Miguel nº 9,10
Rosalía de Castro,Monuments,C Ballesta 13,17 - Carlos Cambronero,Plaza de Carlos Cambronero nº 2,22
Augusto d'Halmar,Monuments,CALLE LORETO Y CHICOTE 8,17 - Carlos Cambronero,Plaza de Carlos Cambronero nº 2,22
Miguel de Cervantes,Monuments,C Cervantes 2,41 - Antón Martín,Calle Atocha nº 54,13
Marcelino Menéndez Pelayo,Monuments,C León 21,41 - Antón Martín,Calle Atocha nº 54,13
"Antonia Mercé, la Argentina",Monuments,C Ave María 8,41 - Antón Martín,Calle Atocha nº 54,13
Francisco de Quevedo y Villegas,Monuments,C Lope de Vega 17,41 - Antón Martín,Calle Atocha nº 54,13
Daniel Urrabieta Vierge,Monuments,C Huertas 28,41 - Antón Martín,Calle Atocha nº 54,13
Abogados Laboristas,Monuments,C Atocha 55,41 - Antón Martín,Calle Atocha nº 54,13
El Abrazo,Monuments,Pza Antón Martín ,41 - Antón Martín,Calle Atocha nº 54,13
Francisco de Quevedo y Villegas,Monuments,C Huertas 43,41 - Antón Martín,Calle Atocha nº 54,13
Miguel de Cervantes,Monuments,C Huertas 28,41 - Antón Martín,Calle Atocha nº 54,13
José Echegaray y Eizaguirre,Monuments,C Huertas 24,41 - Antón Martín,Calle Atocha nº 54,13
Miguel de Cervantes,Monuments,C Cervantes 2,41 - Antón Martín,Calle Atocha nº 54,13
Cinematógrafo,Monuments,CARRERA SAN JERONIMO 32,28 - Sevilla,Calle Alcalá nº 27,18
Conrado del Campo,Monuments,Ctra Aduana 16,28 - Sevilla,Calle Alcalá nº 27,18
Conde de Peñalver,Monuments,C Gran Vía 2,28 - Sevilla,Calle Alcalá nº 27,18
Rafael El Gallo,Monuments,C Cedaceros 3,28 - Sevilla,Calle Alcalá nº 27,18
Centenario de la primera sesión de cine,Monuments,Ctra San Jerónimo 32,28 - Sevilla,Calle Alcalá nº 27,18
Palacio de Miraflores,Monuments,Ctra San Jerónimo 15,28 - Sevilla,Calle Alcalá nº 27,18
Canalejas y Méndez,Monuments,Pza Puerta del Sol 6,33 - Carretas,Calle Carretas nº 8,0
Héroes Populares del Dos de Mayo,Monuments,Pza Puerta del Sol 8,33 - Carretas,Calle Carretas nº 8,0
Fuentes gemelas de la Puerta del Sol,Monuments,Pza Sol ,33 - Carretas,Calle Carretas nº 8,0
Carlos III,Monuments,Pza Puerta del Sol ,33 - Carretas,Calle Carretas nº 8,0
Atentados 11-M,Monuments,Pza Puerta del Sol 7,33 - Carretas,Calle Carretas nº 8,0
Antigua Iglesia y Hospital del Buen Suceso,Monuments, ,33 - Carretas,Calle Carretas nº 8,0
Km. 0,Monuments,Pza Puerta del Sol 8,33 - Carretas,Calle Carretas nº 8,0
Joaquín Costa,Monuments,C Barquillo 11,19 - Prim,Calle Prim nº 2,0
Eduardo Rosales,Monuments,CALLE VALGAME DIOS 2,19 - Prim,Calle Prim nº 2,0
Ruperto Chapí,Monuments,C Arenal 18,25b - Plaza de Celenque B,Plaza de Celenque nº 1,0
Iglesia San Ginés,Monuments,CALLE ARENAL 13,25b - Plaza de Celenque B,Plaza de Celenque nº 1,0
Frascuelo,Monuments,C Arenal 22,25b - Plaza de Celenque B,Plaza de Celenque nº 1,0
Eduardo Alfonso,Monuments,C Arenal 26,25b - Plaza de Celenque B,Plaza de Celenque nº 1,0
Fernando de Castro,Monuments,C Arenal 16,25b - Plaza de Celenque B,Plaza de Celenque nº 1,0
Manuel García Siches,Monuments,Trav Reloj 1,116b - Plaza de España B,Calle Princesa nº 5,0
Maestro Jacinto Guerrero,Monuments,Ctra Maestro Guerrero 2,116b - Plaza de España B,Calle Princesa nº 5,0
Fuente de la Concha o del Nacimiento del Agua,Monuments,Pza España ,116b - Plaza de España B,Calle Princesa nº 5,0
José García Vara,Monuments,C Arrieta 4,24 - Palacio de Oriente,Calle Carlos III nº 1,9
Mariano José de Larra,Monuments,C Santa Clara 3,24 - Palacio de Oriente,Calle Carlos III nº 1,9
Fuente de los Caños del Peral,Monuments,Pza Isabel II ,24 - Palacio de Oriente,Calle Carlos III nº 1,9
Maqueta de la plazuela de los  Caños del Peral,Monuments,Pza Isabel II ,24 - Palacio de Oriente,Calle Carlos III nº 1,9
Maqueta de los recintos amurallados de Madrid,Monuments,Pza Isabel II ,24 - Palacio de Oriente,Calle Carlos III nº 1,9
Iglesia Ntra. Sra. Buena Dicha,Monuments,C Silva 21,2 - Miguel Moya,Calle Miguel Moya nº 1,0
Fuente de Tudescos,Monuments,Pza Soledad Torres Acosta ,2 - Miguel Moya,Calle Miguel Moya nº 1,0
Kymaerxthaere. Puerta de entrada a la umbraesfera,Monuments,Pza Soledad Torres Acosta ,2 - Miguel Moya,Calle Miguel Moya nº 1,0
Iglesia Nuestra Señora Buena Dicha. Lápida conmemorativa,Monuments,C Silva 21,2 - Miguel Moya,Calle Miguel Moya nº 1,0
Instituto Industrial Isabel II,Monuments,C Doctor Cortezo 4,34 - Jacinto Benavente,Plaza de Jacinto Benavente,21
Manuel José Quintana,Monuments,C Marqués Viudo de Pontejos 2,34 - Jacinto Benavente,Plaza de Jacinto Benavente,21
Galicia en Madrid,Monuments,Pza Jacinto Benavente ,34 - Jacinto Benavente,Plaza de Jacinto Benavente,21
Barrendero madrileño,Monuments,Pza Jacinto Benavente ,34 - Jacinto Benavente,Plaza de Jacinto Benavente,21
Bernardo López García,Monuments,C Bernardo López Garcia 9,13 - Conde Duque,Calle Conde Duque nº 22,14
Dos columnas en la calle Conde Duque,Monuments,C Conde Duque ,13 - Conde Duque,Calle Conde Duque nº 22,14
Clara Campoamor,Monuments,Pza Guardias de Corps ,13 - Conde Duque,Calle Conde Duque nº 22,14
Ramón Pelayo,Monuments,C Noviciado 3,15 - San Vicente Ferrer,Calle San Vicente Ferrer nº 64,20
Miguel Morayta Sagrario,Monuments,C Pozas 18,15 - San Vicente Ferrer,Calle San Vicente Ferrer nº 64,20
Joven Bailando,Monuments,C Palma 49,15 - San Vicente Ferrer,Calle San Vicente Ferrer nº 64,20
Pablo Montesino,Monuments,C San Bernardo 70,15 - San Vicente Ferrer,Calle San Vicente Ferrer nº 64,20
Pablo Ruíz Picasso,Monuments,C San Pedro Mártir 5,43 - Jesús y María,Calle Lavapiés nº 34,10
Alberto Aguilera,Monuments,CALLE MAGDALENA 6,43 - Jesús y María,Calle Lavapiés nº 34,10
José Zorrilla,Monuments,C Santa Teresa 2,7 - Hortaleza,Calle Hortaleza nº 75,0
Puente de Segovia,Monuments, Puente de Segovia ,216 - Puerta del Ángel,Plaza Puerta del Ángel nº 4,14
Sagrado Corazón de Jesús,Monuments, ,216 - Puerta del Ángel,Plaza Puerta del Ángel nº 4,14
Fofó,Monuments,PARQUE ATRACCIONES CASA CAMPO ,216 - Puerta del Ángel,Plaza Puerta del Ángel nº 4,14
Estanque y fuente del Parque de Atracciones,Monuments,PARQUE ATRACCIONES CASA CAMPO ,216 - Puerta del Ángel,Plaza Puerta del Ángel nº 4,14
Estanque circular del pabellón de Pontevedra,Monuments,Pza Puerta del Ángel ,216 - Puerta del Ángel,Plaza Puerta del Ángel nº 4,14
Fuente del Canal de la Partida,Monuments,Gta Patines ,216 - Puerta del Ángel,Plaza Puerta del Ángel nº 4,14
Fuente neoclásica baja en la avenida Principal de Provincias,Monuments,C Principal de Provincias ,216 - Puerta del Ángel,Plaza Puerta del Ángel nº 4,14
Fuente de los Caños,Monuments,GLORIETA CAÑOS ,216 - Puerta del Ángel,Plaza Puerta del Ángel nº 4,14
Fuente de las Covas,Monuments,Pº Azul ,216 - Puerta del Ángel,Plaza Puerta del Ángel nº 4,14
Fuente de los Neveros,Monuments,Gta Patines ,216 - Puerta del Ángel,Plaza Puerta del Ángel nº 4,14
Fuente del Plátano Gordo,Monuments,Pº Azul ,216 - Puerta del Ángel,Plaza Puerta del Ángel nº 4,14
Fuente del Triángulo,Monuments,Gta Patines ,216 - Puerta del Ángel,Plaza Puerta del Ángel nº 4,14
Lago de la Casa de Campo,Monuments,ESTACION DE METRO LAGO ,216 - Puerta del Ángel,Plaza Puerta del Ángel nº 4,14
Parque de Atracciones,Monuments, ,216 - Puerta del Ángel,Plaza Puerta del Ángel nº 4,14
Mar,Monuments, ,216 - Puerta del Ángel,Plaza Puerta del Ángel nº 4,14
Remodelación embarcadero deportivo,Monuments,Pº Embarcadero ,216 - Puerta del Ángel,Plaza Puerta del Ángel nº 4,14
Prensa,Monuments,C Principal de Provincias ,216 - Puerta del Ángel,Plaza Puerta del Ángel nº 4,14
Reproducción de la Puerta de Bisagra de Toledo,Monuments,C Principal de Provincias (Parque de la Casa de Campo) 9,216 - Puerta del Ángel,Plaza Puerta del Ángel nº 4,14
