Place of Interest,Type of place,Place address,BiciMAD station,Station locaiton,Available bikes
Fuente monumental en cascada del parque Villa de Vallecas,Monuments, ,221 - Pavones,Calle Hacienda de Pavones nº 342,16
Fuentes de la Puerta del Sol,Monuments,Pº Federico García Lorca ,221 - Pavones,Calle Hacienda de Pavones nº 342,16
Francisco Fatou,Monuments,Cmno Suerte 23,221 - Pavones,Calle Hacienda de Pavones nº 342,16
Juan Malasaña,Monuments,C Sierra Gorda 13,221 - Pavones,Calle Hacienda de Pavones nº 342,16
Junta Municipal de Villa de Vallecas,Monuments,Pº Federico García Lorca 14,221 - Pavones,Calle Hacienda de Pavones nº 342,16
Monolito Doña Rosita la Soltera,Monuments,Pº Federico García Lorca ,221 - Pavones,Calle Hacienda de Pavones nº 342,16
Monolito Romancero Gitano,Monuments,Pº Federico García Lorca 15,221 - Pavones,Calle Hacienda de Pavones nº 342,16
Antonio de Andrés Martínez,Monuments,PLAZA DON ANTONIO DE ANDRES 1,221 - Pavones,Calle Hacienda de Pavones nº 342,16
Leda y el cisne,Monuments,CALLE VILLABLANCA 41,221 - Pavones,Calle Hacienda de Pavones nº 342,16
Cástor y Pólux,Monuments,C Villablanca 41,221 - Pavones,Calle Hacienda de Pavones nº 342,16
Polideportivo de Vicálvaro,Monuments,PASEO POLIDEPORTIVO 3,221 - Pavones,Calle Hacienda de Pavones nº 342,16
Enrique Tierno Galván,Monuments,PLAZA DON ANTONIO DE ANDRES 18,221 - Pavones,Calle Hacienda de Pavones nº 342,16
Obelisco de la Vicalvarada,Monuments, ,221 - Pavones,Calle Hacienda de Pavones nº 342,16
Por la Paz y el Desarme,Monuments,AUDITORIO PARQUE DE LA VICALVARADA ,221 - Pavones,Calle Hacienda de Pavones nº 342,16
Humilladero de la ermita del Santo Cristo de la Guía,Monuments,CALLE CASALARREINA 26,221 - Pavones,Calle Hacienda de Pavones nº 342,16
Fuentes en la glorieta Ruíz Giménez y monolito primera Fuente Canal Y II,Monuments,CALLE JOAQUIN RUIZ-GIMENEZ CORTES ,221 - Pavones,Calle Hacienda de Pavones nº 342,16
Fuente Plaza Alosno,Monuments,PLAZA ALOSNO 4,221 - Pavones,Calle Hacienda de Pavones nº 342,16
Fuente plaza San Jaime,Monuments,C San Jaime ,221 - Pavones,Calle Hacienda de Pavones nº 342,16
Fuente en homenaje a la Mujer,Monuments,PLAZA ALSACIA 1,221 - Pavones,Calle Hacienda de Pavones nº 342,16
Fuente Santa Eugenia,Monuments,Avda Santa Eugenia ,221 - Pavones,Calle Hacienda de Pavones nº 342,16
Fuente San Cipriano,Monuments,CALLE LAGO SANABRIA 1,221 - Pavones,Calle Hacienda de Pavones nº 342,16
Fuente en la avenida Pablo Neruda,Monuments,Avda Miguel Hernández s/n,221 - Pavones,Calle Hacienda de Pavones nº 342,16
Miguel Hernández,Monuments,Avda Albufera ,221 - Pavones,Calle Hacienda de Pavones nº 342,16
Fuente en la avenida de la Albufera,Monuments,Avda Albufera ,221 - Pavones,Calle Hacienda de Pavones nº 342,16
Apeadero de Pavones,Monuments, ,221 - Pavones,Calle Hacienda de Pavones nº 342,16
Fuente Pavones,Monuments, ,221 - Pavones,Calle Hacienda de Pavones nº 342,16
Fuente plaza Munilla,Monuments,PLAZA MUNILLA 1,221 - Pavones,Calle Hacienda de Pavones nº 342,16
Composición geométrica,Monuments,AUDITORIO PARQUE DE LA VICALVARADA ,221 - Pavones,Calle Hacienda de Pavones nº 342,16
Fuente en la calle Fuente Carrantona,Monuments,C Arroyo Fontarrón s/n,221 - Pavones,Calle Hacienda de Pavones nº 342,16
Fuente ornamental I en Vicálvaro,Monuments,CALLE CASALARREINA 3,221 - Pavones,Calle Hacienda de Pavones nº 342,16
Fuente ornamental II en Vicálvaro,Monuments,C Casalarreina s/n,221 - Pavones,Calle Hacienda de Pavones nº 342,16
Fuente ornamental III,Monuments,CALLE CASALARREINA 3,221 - Pavones,Calle Hacienda de Pavones nº 342,16
Fuente ornamental IV en Vicálvaro,Monuments,C Casalarreina s/n,221 - Pavones,Calle Hacienda de Pavones nº 342,16
Fuente ornamental V en Vicálvaro,Monuments,CALLE CASALARREINA 3,221 - Pavones,Calle Hacienda de Pavones nº 342,16
Fuente ornamental VI en Vicálvaro,Monuments,C Casalarreina s/n,221 - Pavones,Calle Hacienda de Pavones nº 342,16
Lago-ría-canal-estanque del parque Cuña Verde,Monuments,C Casalarreina s/n,221 - Pavones,Calle Hacienda de Pavones nº 342,16
Anfiteatro del parque Cuña Verde de Vicálvaro,Monuments,CALLE CASALARREINA 3,221 - Pavones,Calle Hacienda de Pavones nº 342,16
Busto Pablo Neruda,Monuments,Avda Pablo Neruda 40,221 - Pavones,Calle Hacienda de Pavones nº 342,16
Fuente ornamental Pico de Cierva,Monuments,C Montes de la Barbanza ,221 - Pavones,Calle Hacienda de Pavones nº 342,16
Cabeza olmeca,Monuments,Avda del Ensanche de Vallecas 13,221 - Pavones,Calle Hacienda de Pavones nº 342,16
Rafael Alberti,Monuments,Avda Rafael Alberti 11,221 - Pavones,Calle Hacienda de Pavones nº 342,16
Fuente ornamental Cordel de Pavones,Monuments,CALLE CORDEL DE PAVONES 48,221 - Pavones,Calle Hacienda de Pavones nº 342,16
Fuente ornamental bulevar José Prat,Monuments,BULEVAR INDALECIO PRIETO 15,221 - Pavones,Calle Hacienda de Pavones nº 342,16
Fuente ornamental Ladera de los Almendros,Monuments,BULEVAR JOSE PRAT 5,221 - Pavones,Calle Hacienda de Pavones nº 342,16
Fuente ornamental Copérnico,Monuments,CALLE ANA MARISCAL 1,221 - Pavones,Calle Hacienda de Pavones nº 342,16
Estanque Ensanche de Vallecas,Monuments,AVENIDA ENSANCHE DE VALLECAS 1,221 - Pavones,Calle Hacienda de Pavones nº 342,16
Fuente ornamental García Lorca-Congosto,Monuments,C Cogosto ,221 - Pavones,Calle Hacienda de Pavones nº 342,16
Monolito Poema del Cante Jondo,Monuments,Pº Federico García Lorca ,221 - Pavones,Calle Hacienda de Pavones nº 342,16
Ilusión truncada Monumento víctimas 11-M,Monuments,Avda Santa Eugenia ,221 - Pavones,Calle Hacienda de Pavones nº 342,16
Fuente ornamental Valderrebollo,Monuments,C Tineo ,221 - Pavones,Calle Hacienda de Pavones nº 342,16
Llanto por Ignacio Sánchez Mejías,Monuments,Pº Federico García Lorca ,221 - Pavones,Calle Hacienda de Pavones nº 342,16
Monolito Mariana Pineda,Monuments,Pº Federico García Lorca ,221 - Pavones,Calle Hacienda de Pavones nº 342,16
El Encuentro,Monuments,C Fuente Carrantona 8,221 - Pavones,Calle Hacienda de Pavones nº 342,16
Nuestra Señora de Moratalaz,Monuments,C Entre Arroyos 19,218 - Camino Vinateros,Calle Camino de los Vinateros nº 28,16
Escultura abstracta en el camino Vinateros,Monuments,Cmno Vinateros 51,218 - Camino Vinateros,Calle Camino de los Vinateros nº 28,16
Madre e hijos,Monuments,Pza Corregidor Alonso de Aguilar ,218 - Camino Vinateros,Calle Camino de los Vinateros nº 28,16
Fuente del parque Darwin,Monuments, ,218 - Camino Vinateros,Calle Camino de los Vinateros nº 28,16
Doctor García Tapia,Monuments,C Arroyo Belincoso ,218 - Camino Vinateros,Calle Camino de los Vinateros nº 28,16
Hogar Ferroviario-Trenes,Monuments,C Manuel María Arrillaga s/n,218 - Camino Vinateros,Calle Camino de los Vinateros nº 28,16
Dos bajorrelieves Nª Sª del Rosario,Monuments,C Arturo Soria 278,254 - Pío XII,Avenida Pío XII nº 3,17
Escultura de hormigón Instituto Eduardo Torroja,Monuments,C Serrano Galvache 4,254 - Pío XII,Avenida Pío XII nº 3,17
Estanque trapezoidal Costillares,Monuments,C Serrano Galvache 4,254 - Pío XII,Avenida Pío XII nº 3,17
Ancla,Monuments,C Arturo Soria 271,254 - Pío XII,Avenida Pío XII nº 3,17
Escultura en la plaza Presidente Cárdenas,Monuments,PLAZA PRESIDENTE CARDENAS 1,254 - Pío XII,Avenida Pío XII nº 3,17
Estanque Arturo Soria V,Monuments,C Arturo Soria 276,254 - Pío XII,Avenida Pío XII nº 3,17
Estanque Arturo Soria VI,Monuments,C Arturo Soria 278,254 - Pío XII,Avenida Pío XII nº 3,17
Monolito a Arturo Soria,Monuments,C Arturo Soria 233,254 - Pío XII,Avenida Pío XII nº 3,17
Arcángel San Miguel,Monuments,C Costa del Sol 1,254 - Pío XII,Avenida Pío XII nº 3,17
Fuente circular del barrio de San Miguel,Monuments,C Costa del Sol 1,254 - Pío XII,Avenida Pío XII nº 3,17
Fuente del parque Doña Guiomar,Monuments, ,254 - Pío XII,Avenida Pío XII nº 3,17
Polideportivo de Hortaleza,Monuments,Ctra Acceso a la Estación de Hortaleza ,254 - Pío XII,Avenida Pío XII nº 3,17
Pilar I,Monuments,C Costa del Sol 2,254 - Pío XII,Avenida Pío XII nº 3,17
Pilares II y III,Monuments,C Costa del Sol 8,254 - Pío XII,Avenida Pío XII nº 3,17
Fuente en la plaza Cruz Latina,Monuments,Pza Cruz Latina ,254 - Pío XII,Avenida Pío XII nº 3,17
Gloria Fuertes,Monuments,PLAZA PERU 1,254 - Pío XII,Avenida Pío XII nº 3,17
Fuente en memoria de Pedro Barcina García,Monuments,Avda San Luis 106,254 - Pío XII,Avenida Pío XII nº 3,17
Fuente en la plaza de Villalcázar de Sirga,Monuments,Pza Villalcázar de Sirga ,254 - Pío XII,Avenida Pío XII nº 3,17
El Guerrero,Monuments,C Santa Irene ,233 - Marqués de Corbera 12,Avenida Marqués de Corbera nº 12,15
Fuente mural en la Elipa,Monuments,Avda Marqués de Corbera 10,233 - Marqués de Corbera 12,Avenida Marqués de Corbera nº 12,15
Fuente en la avenida Marqués de Corbera,Monuments,Avda Marqués de Corbera 1,233 - Marqués de Corbera 12,Avenida Marqués de Corbera nº 12,15
San Juan de Dios,Monuments,C López de Hoyos 259,251 - Corazón de María,Calle Santa Hortensia nº 31,5
Fuente San Juan de Dios,Monuments,C López de Hoyos 259,251 - Corazón de María,Calle Santa Hortensia nº 31,5
Ángeles de la Paz,Monuments,Avda Bruselas ,251 - Corazón de María,Calle Santa Hortensia nº 31,5
Félix Rodríguez de la Fuente,Monuments,PARQUE FELIX RODRIGUEZ DE LA FUENTE ,251 - Corazón de María,Calle Santa Hortensia nº 31,5
General Martín Miguel de Güemes,Monuments,PLAZA CIUDAD DE SALTA 1,251 - Corazón de María,Calle Santa Hortensia nº 31,5
San Cristóbal,Monuments,URBANIZACION CIUDAD PEGASO ,215 - Gutierre de Cetina,Calle Gutierre de Cetina nº 77,6
Pegaso,Monuments,Ctra Acceso al Aeropuerto ,215 - Gutierre de Cetina,Calle Gutierre de Cetina nº 77,6
Rapto de Europa,Monuments, Aeropuerto de Barajas ,215 - Gutierre de Cetina,Calle Gutierre de Cetina nº 77,6
Estanque elíptico IVECO-Pegaso,Monuments,Avda Aragón 402,215 - Gutierre de Cetina,Calle Gutierre de Cetina nº 77,6
Cruceiro Virgen del Camino,Monuments,C Fenelón 42,215 - Gutierre de Cetina,Calle Gutierre de Cetina nº 77,6
Portada de Torre Arias,Monuments,CALLE ALCALA 551,215 - Gutierre de Cetina,Calle Gutierre de Cetina nº 77,6
Fuente del parque Arriaga,Monuments,C Arriaga 17,215 - Gutierre de Cetina,Calle Gutierre de Cetina nº 77,6
Fuente plaza Doctor Cirajas,Monuments,Pza Doctor Cirajas ,215 - Gutierre de Cetina,Calle Gutierre de Cetina nº 77,6
Fuentes en la plaza de Ciudad Lineal,Monuments,C Alcalá 416,215 - Gutierre de Cetina,Calle Gutierre de Cetina nº 77,6
Centro de Servicios Sociales Luis Vives,Monuments,AVENIDA INSTITUCION LIBRE DE ENSE&amp;Ntilde;ANZA 160,215 - Gutierre de Cetina,Calle Gutierre de Cetina nº 77,6
La Ciudad Lineal,Monuments,C Hermanos García Noblejas 14,215 - Gutierre de Cetina,Calle Gutierre de Cetina nº 77,6
Francisco Largo Caballero,Monuments,C Francisco Largo Caballero ,215 - Gutierre de Cetina,Calle Gutierre de Cetina nº 77,6
Antonio Machado,Monuments,CALLE SAN ROMAN DEL VALLE 8,215 - Gutierre de Cetina,Calle Gutierre de Cetina nº 77,6
Conjunto escultórico parque Arquitecto Antonio Palacios,Monuments,CALLE FENELON 17,215 - Gutierre de Cetina,Calle Gutierre de Cetina nº 77,6
José Cubero (Yiyo),Monuments,CALLE SAN MARIANO 37,215 - Gutierre de Cetina,Calle Gutierre de Cetina nº 77,6
Escultura La Vivienda,Monuments,CALLE JOSE RAMON VIZCAINO 5,215 - Gutierre de Cetina,Calle Gutierre de Cetina nº 77,6
Estanques con dos fuentes en la Quinta de los Molinos,Monuments,CALLE ALCALA 527,215 - Gutierre de Cetina,Calle Gutierre de Cetina nº 77,6
Estanque poligonal del parque Marqués de Suances,Monuments,Avda Veinticinco de Septiembre ,215 - Gutierre de Cetina,Calle Gutierre de Cetina nº 77,6
Estanque elíptico de la Quinta de los Molinos,Monuments,CALLE ALCALA 527,215 - Gutierre de Cetina,Calle Gutierre de Cetina nº 77,6
Fuente circular de la Quinta de los Molinos,Monuments,C Alcalá 527,215 - Gutierre de Cetina,Calle Gutierre de Cetina nº 77,6
Fuente del invernadero de la Quinta de los Molinos,Monuments,CALLE ALCALA 527,215 - Gutierre de Cetina,Calle Gutierre de Cetina nº 77,6
Fuente de la Casa del Reloj de la Quinta de los Molinos,Monuments,CALLE ALCALA 527,215 - Gutierre de Cetina,Calle Gutierre de Cetina nº 77,6
Fuente entre dos escaleras en la Quinta de los Molinos,Monuments,CALLE ALCALA 527,215 - Gutierre de Cetina,Calle Gutierre de Cetina nº 77,6
Fuente con taza de piedra de la Quinta de los Molinos,Monuments,CALLE ALCALA 527,215 - Gutierre de Cetina,Calle Gutierre de Cetina nº 77,6
Fuentes gemelas de la Quinta de los Molinos,Monuments,CALLE ALCALA 527,215 - Gutierre de Cetina,Calle Gutierre de Cetina nº 77,6
Fuente en la plaza Mora de Rubielos,Monuments,Pza Mora de Rubielos ,215 - Gutierre de Cetina,Calle Gutierre de Cetina nº 77,6
Fuente neobarroca de la Quinta de los Molinos,Monuments,CALLE ALCALA 527,215 - Gutierre de Cetina,Calle Gutierre de Cetina nº 77,6
Fuente del Bambú,Monuments,CALLE ALCALA 527,215 - Gutierre de Cetina,Calle Gutierre de Cetina nº 77,6
Fuente Paraíso,Monuments,C Albaida 82,215 - Gutierre de Cetina,Calle Gutierre de Cetina nº 77,6
Lago de los Molinos,Monuments,CALLE ALCALA 527,215 - Gutierre de Cetina,Calle Gutierre de Cetina nº 77,6
Centro Cultural Antonio Machado,Monuments,CALLE SAN ROMAN DEL VALLE 8,215 - Gutierre de Cetina,Calle Gutierre de Cetina nº 77,6
Centro Juvenil Miguel de Cervantes,Monuments,CALLE FENELON 6,215 - Gutierre de Cetina,Calle Gutierre de Cetina nº 77,6
Lápida a José Cubero (Yiyo),Monuments,CALLE CANAL DEL BOSFORO 30,215 - Gutierre de Cetina,Calle Gutierre de Cetina nº 77,6
Nacho Ugalde,Monuments,PLAZA IGNACIO UGALDE 5,215 - Gutierre de Cetina,Calle Gutierre de Cetina nº 77,6
Canillejas,Monuments,Pza Mora de Rubielos 4,215 - Gutierre de Cetina,Calle Gutierre de Cetina nº 77,6
Columna corintia en la Quinta de los Molinos,Monuments,CALLE ALCALA 527,215 - Gutierre de Cetina,Calle Gutierre de Cetina nº 77,6
Columna jónica en la Quinta de los Molinos,Monuments,CALLE ALCALA 527,215 - Gutierre de Cetina,Calle Gutierre de Cetina nº 77,6
Ensidesa,Monuments,AVENIDA VEINTICINCO DE SEPTIEMBRE 1,215 - Gutierre de Cetina,Calle Gutierre de Cetina nº 77,6
Pilono Colonia Alfonso XIII,Monuments,GLORIETA MONTAÑA 2,215 - Gutierre de Cetina,Calle Gutierre de Cetina nº 77,6
Reloj de sol,Monuments,AVENIDA ARCENTALES 2,215 - Gutierre de Cetina,Calle Gutierre de Cetina nº 77,6
Baco,Monuments,PARQUE ALAMEDA DE OSUNA ,215 - Gutierre de Cetina,Calle Gutierre de Cetina nº 77,6
Columnas de los Enfrentados,Monuments, ,215 - Gutierre de Cetina,Calle Gutierre de Cetina nº 77,6
Columna de Saturno,Monuments,PARQUE ALAMEDA DE OSUNA ,215 - Gutierre de Cetina,Calle Gutierre de Cetina nº 77,6
Exedra,Monuments, ,215 - Gutierre de Cetina,Calle Gutierre de Cetina nº 77,6
Monumento al III duque de Osuna,Monuments, ,215 - Gutierre de Cetina,Calle Gutierre de Cetina nº 77,6
Estanque circular de la avenida Cantabria,Monuments,Avda Cantabria ,215 - Gutierre de Cetina,Calle Gutierre de Cetina nº 77,6
Estanque de los Cisnes,Monuments, ,215 - Gutierre de Cetina,Calle Gutierre de Cetina nº 77,6
Estanques del Parterre,Monuments, ,215 - Gutierre de Cetina,Calle Gutierre de Cetina nº 77,6
Estanque de los Patos,Monuments,PARQUE ALAMEDA DE OSUNA ,215 - Gutierre de Cetina,Calle Gutierre de Cetina nº 77,6
Estanque pequeño en la avenida Cantabria I,Monuments,Avda Cantabria ,215 - Gutierre de Cetina,Calle Gutierre de Cetina nº 77,6
Estanque pequeño en la avenida Cantabria II,Monuments,Avda Cantabria ,215 - Gutierre de Cetina,Calle Gutierre de Cetina nº 77,6
Estanque rectangular en la avenida Cantabria,Monuments,Avda Cantabria ,215 - Gutierre de Cetina,Calle Gutierre de Cetina nº 77,6
Estanque de las Tencas,Monuments, ,215 - Gutierre de Cetina,Calle Gutierre de Cetina nº 77,6
Fuente octogonal del parque del Capricho I,Monuments, ,215 - Gutierre de Cetina,Calle Gutierre de Cetina nº 77,6
Fuente octogonal del parque del Capricho II,Monuments,PARQUE ALAMEDA DE OSUNA ,215 - Gutierre de Cetina,Calle Gutierre de Cetina nº 77,6
Fuente en la plaza Mayor de Barajas,Monuments,PLAZA MAYOR DE BARAJAS 1,215 - Gutierre de Cetina,Calle Gutierre de Cetina nº 77,6
Fuente de la Casa de Oficios,Monuments, ,215 - Gutierre de Cetina,Calle Gutierre de Cetina nº 77,6
Fuente cibernética del Auditorio del parque Juan Carlos I,Monuments,AUDITORIO JUAN CARLOS I ,215 - Gutierre de Cetina,Calle Gutierre de Cetina nº 77,6
Fuente de los Delfines,Monuments, ,215 - Gutierre de Cetina,Calle Gutierre de Cetina nº 77,6
Fuente de las Ranas,Monuments, ,215 - Gutierre de Cetina,Calle Gutierre de Cetina nº 77,6
Gruta de la Fuente de las Ranas,Monuments, ,215 - Gutierre de Cetina,Calle Gutierre de Cetina nº 77,6
Gruta del Laberinto,Monuments, ,215 - Gutierre de Cetina,Calle Gutierre de Cetina nº 77,6
Ría y lago de El Capricho,Monuments, ,215 - Gutierre de Cetina,Calle Gutierre de Cetina nº 77,6
Hermanos Falcó y Álvarez de Toledo,Monuments,PLAZA MAYOR DE BARAJAS 1,215 - Gutierre de Cetina,Calle Gutierre de Cetina nº 77,6
Campana de la plaza Mercurio,Monuments,Pza Mercurio ,215 - Gutierre de Cetina,Calle Gutierre de Cetina nº 77,6
Puente de hierro sobre la ría,Monuments, ,215 - Gutierre de Cetina,Calle Gutierre de Cetina nº 77,6
Templete elíptico del Parque de El Capricho,Monuments, ,215 - Gutierre de Cetina,Calle Gutierre de Cetina nº 77,6
Primera Piedra Ciudad Lineal,Monuments,C Arturo Soria 3,215 - Gutierre de Cetina,Calle Gutierre de Cetina nº 77,6
Manuel Rodríguez (Manolete),Monuments,CALLE ALCALA 551,215 - Gutierre de Cetina,Calle Gutierre de Cetina nº 77,6
Fuente Francisco Largo Caballero,Monuments,C Francisco Largo Caballero ,215 - Gutierre de Cetina,Calle Gutierre de Cetina nº 77,6
Miguel de Cervantes,Monuments,AVENIDA ARCENTALES 12,215 - Gutierre de Cetina,Calle Gutierre de Cetina nº 77,6
Al Siglo XXI,Monuments,AVENIDA CANILLEJAS A VICALVARO 159,215 - Gutierre de Cetina,Calle Gutierre de Cetina nº 77,6
Lápida parque Marqués de Suanzes,Monuments,AVENIDA VEINTICINCO DE SEPTIEMBRE 1,215 - Gutierre de Cetina,Calle Gutierre de Cetina nº 77,6
Fuente en la plaza Navío,Monuments,Pza Navío ,215 - Gutierre de Cetina,Calle Gutierre de Cetina nº 77,6
Fuente en la avenida de Logroño I,Monuments,AVENIDA LOGROÑO 2,215 - Gutierre de Cetina,Calle Gutierre de Cetina nº 77,6
Fuente en la avenida de Logroño II,Monuments,Avda Logroño ,215 - Gutierre de Cetina,Calle Gutierre de Cetina nº 77,6
Fuente en la avenida de Logroño III,Monuments,Avda Logroño 38,215 - Gutierre de Cetina,Calle Gutierre de Cetina nº 77,6
Fuente en la avenida de Logroño IV,Monuments,Avda Logroño 42,215 - Gutierre de Cetina,Calle Gutierre de Cetina nº 77,6
Fuente con escultura en la avenida de Logroño,Monuments,Avda Logroño ,215 - Gutierre de Cetina,Calle Gutierre de Cetina nº 77,6
Fuente de la plaza de Mercurio,Monuments,Pza Mercurio ,215 - Gutierre de Cetina,Calle Gutierre de Cetina nº 77,6
Fuente en la avenida de Logroño V,Monuments,Avda Logroño 191,215 - Gutierre de Cetina,Calle Gutierre de Cetina nº 77,6
Fuentes en la calle Hermanos García Noblejas,Monuments,AVENIDA INSTITUCION LIBRE DE ENSE&amp;Ntilde;ANZA 128,215 - Gutierre de Cetina,Calle Gutierre de Cetina nº 77,6
Fuente Poliedros Maclados en el Cubo,Monuments,C Castillo de Uclés 36,215 - Gutierre de Cetina,Calle Gutierre de Cetina nº 77,6
Fuente del nuevo acceso al parque Juan Carlos I,Monuments,Avda Logroño 179,215 - Gutierre de Cetina,Calle Gutierre de Cetina nº 77,6
Fuente elíptica en la avenida de Logroño,Monuments,Avda Logroño 183,215 - Gutierre de Cetina,Calle Gutierre de Cetina nº 77,6
Centro Integrado Teresa de Calcuta,Monuments,Pza Navío ,215 - Gutierre de Cetina,Calle Gutierre de Cetina nº 77,6
Fuente circular del barrio Alameda de Osuna,Monuments,C Bergantín ,215 - Gutierre de Cetina,Calle Gutierre de Cetina nº 77,6
Plaza de los Emperadores,Monuments, ,215 - Gutierre de Cetina,Calle Gutierre de Cetina nº 77,6
Estanque Puerta Logroño,Monuments, ,215 - Gutierre de Cetina,Calle Gutierre de Cetina nº 77,6
Fuente en la avenida de Logroño VI,Monuments,Avda Logroño 205,215 - Gutierre de Cetina,Calle Gutierre de Cetina nº 77,6
Fray Pedro Ponce de León,Monuments,AVENIDA CANILLEJAS A VICALVARO 82,215 - Gutierre de Cetina,Calle Gutierre de Cetina nº 77,6
Fuente de los Peces,Monuments,PASEO LA HABANA 1,150 - Castellana frente a Hermanos Pinzón,Paseo de la Castellana nº 122,0
Fuente plaza de Quito,Monuments,PLAZA QUITO ,150 - Castellana frente a Hermanos Pinzón,Paseo de la Castellana nº 122,0
Luis Fernández Ardavín,Monuments,Pza Poeta Manuel del Palacio 4,150 - Castellana frente a Hermanos Pinzón,Paseo de la Castellana nº 122,0
Fuente del Centro de investigaciones biológicas C.S.I.C.,Monuments,CALLE VELAZQUEZ 144,140 - Velázquez 130,Calle Velázquez nº 130,4
Pairón o Peirón,Monuments,C María de Molina ,140 - Velázquez 130,Calle Velázquez nº 130,4
Fuentes gemelas López de Hoyos,Monuments,CALLE LOPEZ DE HOYOS 27,140 - Velázquez 130,Calle Velázquez nº 130,4
Fuente del Ministerio de Industria,Monuments,PASEO CASTELLANA 158,253 - Doctor Fleming,Calle Doctor Fleming nº 7,8
Pedro Escartín,Monuments,PASEO CASTELLANA 142,253 - Doctor Fleming,Calle Doctor Fleming nº 7,8
Fuente del Ministerio de Economía,Monuments,PASEO CASTELLANA 166,157 - Castellana 164,Paseo de la Castellana nº 164,14
Al Niño,Monuments,AVENIDA ALBERTO ALCOCER 1,157 - Castellana 164,Paseo de la Castellana nº 164,14
Fuente Géminis,Monuments,CALLE RAIMUNDO FERNANDEZ VILLAVERDE 34,133 - Raimundo Fernández,Calle Raimundo Fernández Villaverde nº 33,1
Tríptico en el Hospital de Jornaleros,Monuments,CALLE MAUDES 17,133 - Raimundo Fernández,Calle Raimundo Fernández Villaverde nº 33,1
Fuente de la Vaguada,Monuments,CALLE GINZO DE LIMIA 2,207 - Remonta,Calle Azucenas nº 1,12
Mural la Remonta,Monuments,PLAZA REMONTA 1,207 - Remonta,Calle Azucenas nº 1,12
Fuentes del parque Vaguada,Monuments,Avda Betanzos ,207 - Remonta,Calle Azucenas nº 1,12
Centro Cultural Remonta,Monuments,PLAZA REMONTA 12,207 - Remonta,Calle Azucenas nº 1,12
Monolito de Pizarra II,Monuments,Avda Betanzos ,207 - Remonta,Calle Azucenas nº 1,12
Hombres y Proporciones,Monuments,PASAJE MAESTROS LADRILLEROS 1,207 - Remonta,Calle Azucenas nº 1,12
Fuente Cascada-Reloj Noria,Monuments,CALLE SINESIO DELGADO 40,207 - Remonta,Calle Azucenas nº 1,12
Fuente de San Isidro,Monuments,Pº Quince de Mayo 62,223 - Ermita Santo,Paseo de la Ermita del Santo nº 48,5
Atrio de la ermita de San Isidro,Monuments,Pº Ermita del Santo 78,223 - Ermita Santo,Paseo de la Ermita del Santo nº 48,5
Francisco de Goya,Monuments,Pº Ermita del Santo ,223 - Ermita Santo,Paseo de la Ermita del Santo nº 48,5
Ventana a Madrid,Monuments,C San Isidro ,223 - Ermita Santo,Paseo de la Ermita del Santo nº 48,5
Estanque central del parque de San Isidro,Monuments,PARQUE SAN ISIDRO ,223 - Ermita Santo,Paseo de la Ermita del Santo nº 48,5
Estanque este del parque de San Isidro,Monuments,PARQUE SAN ISIDRO ,223 - Ermita Santo,Paseo de la Ermita del Santo nº 48,5
Estanque oeste del parque de San Isidro,Monuments,PARQUE SAN ISIDRO ,223 - Ermita Santo,Paseo de la Ermita del Santo nº 48,5
Fuente de los Barcos,Monuments,PARQUE SAN ISIDRO ,223 - Ermita Santo,Paseo de la Ermita del Santo nº 48,5
Fuente circular del parque de San Isidro,Monuments,C San Isidro ,223 - Ermita Santo,Paseo de la Ermita del Santo nº 48,5
Fuente de la escultura 'Ventana a Madrid',Monuments,Pº Quince de Mayo ,223 - Ermita Santo,Paseo de la Ermita del Santo nº 48,5
Parque de San Isidro,Monuments,Pº Ermita del Santo ,223 - Ermita Santo,Paseo de la Ermita del Santo nº 48,5
Roger de Flor,Monuments,Pza Roger de Flor ,223 - Ermita Santo,Paseo de la Ermita del Santo nº 48,5
Mártires de la Sacramental de San Isidro,Monuments,Pº Ermita del Santo 78,223 - Ermita Santo,Paseo de la Ermita del Santo nº 48,5
Cruceiro de la Ermita de San Isidro,Monuments,Pº Ermita del Santo 78,223 - Ermita Santo,Paseo de la Ermita del Santo nº 48,5
Jardines del Maestro Padilla,Monuments, ,223 - Ermita Santo,Paseo de la Ermita del Santo nº 48,5
Fuente ornamental del parque Cuña Verde,Monuments,PARQUE CUÑA VERDE ,223 - Ermita Santo,Paseo de la Ermita del Santo nº 48,5
Lago artificial en el parque Cuña Verde,Monuments,PARQUE CUÑA VERDE ,223 - Ermita Santo,Paseo de la Ermita del Santo nº 48,5
Puente Principado de Andorra,Monuments,"Avda Manzanares, del 48",223 - Ermita Santo,Paseo de la Ermita del Santo nº 48,5
Puerta Real del Jardín Botánico,Monuments,Pº Prado 11,67 - Almadén,Calle Almadén nº 28,15
Fuentecillas del Prado,Monuments,Pº Prado ,67 - Almadén,Calle Almadén nº 28,15
Rafael Martínez Molina,Monuments,C Atocha 105,67 - Almadén,Calle Almadén nº 28,15
Capiteles Paseo del Prado,Monuments,Pº Prado ,67 - Almadén,Calle Almadén nº 28,15
Planta cimientos Fábrica Platerías,Monuments,Pza Platería de Martínez 1,67 - Almadén,Calle Almadén nº 28,15
Planta cimientos Convento Trinitarios,Monuments,Pza Platería de Martínez ,67 - Almadén,Calle Almadén nº 28,15
Iglesia de San Juan Evangelista,Monuments,Pza Venecia 1,242 - Avenida Bruselas,Avenida Bruselas nº 56,11
Fuente en la calle Brescia,Monuments,C Brescia 1,242 - Avenida Bruselas,Avenida Bruselas nº 56,11
Mártires San Fermín de los Navarros,Monuments,PASEO EDUARDO DATO 10,198 - Rubén Darío,Glorieta Rubén Darío 2,7
Rubén Darío,Monuments,GLORIETA RUBEN DARIO 1,198 - Rubén Darío,Glorieta Rubén Darío 2,7
Federico Romero Sarachaga,Monuments,CALLE EL ESPA&amp;Ntilde;OLETO 23,198 - Rubén Darío,Glorieta Rubén Darío 2,7
Rubén Darío,Monuments,GLORIETA RUBEN DARIO 4,198 - Rubén Darío,Glorieta Rubén Darío 2,7
Enrique de la Mata Gorostizaga,Monuments,Gta Rubén Darío 4,198 - Rubén Darío,Glorieta Rubén Darío 2,7
Parque de las Naciones,Monuments,CALLE GUZMAN EL BUENO 1,123 - Guzmán el Bueno,Calle Guzmán el Bueno nº 1,7
