Place of Interest,Type of place,Place address,BiciMAD station,Station locaiton,Available bikes
Fuentes gemelas del palacio viejo de la reina Cristina,Monuments,CALLE GENERAL RICARDOS 179,212 - Marqués de Vadillo,Glorieta Marqués de Vadillo nº 9,2
Asilo de Inválidos,Monuments,C Arnedo 22,212 - Marqués de Vadillo,Glorieta Marqués de Vadillo nº 9,2
Moreno Benítez Juan,Monuments,C General Ricardos 179,212 - Marqués de Vadillo,Glorieta Marqués de Vadillo nº 9,2
Cruz de Piedra,Monuments,Pza Parroquia 1,212 - Marqués de Vadillo,Glorieta Marqués de Vadillo nº 9,2
San Isidro,Monuments,PUENTE TOLEDO ,212 - Marqués de Vadillo,Glorieta Marqués de Vadillo nº 9,2
Escultura en la calle Belzunegui,Monuments,C Belzunegui ,212 - Marqués de Vadillo,Glorieta Marqués de Vadillo nº 9,2
La Flecha,Monuments,Avda Vía Lusitana ,212 - Marqués de Vadillo,Glorieta Marqués de Vadillo nº 9,2
Puerta de los Osos,Monuments,C General Ricardos 179,212 - Marqués de Vadillo,Glorieta Marqués de Vadillo nº 9,2
Fuente con farola en la calle General Ricardos,Monuments,C General Ricardos ,212 - Marqués de Vadillo,Glorieta Marqués de Vadillo nº 9,2
Fuente de la Junta Municipal de Carabanchel,Monuments,Pza Carabanchel ,212 - Marqués de Vadillo,Glorieta Marqués de Vadillo nº 9,2
Fuente circular en la glorieta Marques de Vadillo,Monuments,Gta Marqués de Vadillo ,212 - Marqués de Vadillo,Glorieta Marqués de Vadillo nº 9,2
Fuente plaza de Carabanchel,Monuments,Pza Carabanchel ,212 - Marqués de Vadillo,Glorieta Marqués de Vadillo nº 9,2
Fuente plaza Eliptica,Monuments,Pza Fernández Ladreda ,212 - Marqués de Vadillo,Glorieta Marqués de Vadillo nº 9,2
Colonia Torres Garrido,Monuments,Col Torres Garrido ,212 - Marqués de Vadillo,Glorieta Marqués de Vadillo nº 9,2
Lola Membrives,Monuments,C Lola Membrives 1,212 - Marqués de Vadillo,Glorieta Marqués de Vadillo nº 9,2
Matadero,Monuments,C Padre Amigó 4,212 - Marqués de Vadillo,Glorieta Marqués de Vadillo nº 9,2
Santa Rosa,Monuments,Col Torres Garrido ,212 - Marqués de Vadillo,Glorieta Marqués de Vadillo nº 9,2
Fuente nueva de la glorieta Marques de Vadillo,Monuments,Gta Marqués de Vadillo ,212 - Marqués de Vadillo,Glorieta Marqués de Vadillo nº 9,2
Fuente circular en la calle Muñoz Grandes,Monuments,Paseo Marcelino Camacho 6,212 - Marqués de Vadillo,Glorieta Marqués de Vadillo nº 9,2
Fuente Valle de oro,Monuments,C General Ricardos ,212 - Marqués de Vadillo,Glorieta Marqués de Vadillo nº 9,2
La Familia,Monuments,Avda Oporto ,212 - Marqués de Vadillo,Glorieta Marqués de Vadillo nº 9,2
Fuentes en la calle Vía Lusitana,Monuments,C Braganza ,212 - Marqués de Vadillo,Glorieta Marqués de Vadillo nº 9,2
Fuentes de la avenida Poblados,Monuments,Avda Poblados ,212 - Marqués de Vadillo,Glorieta Marqués de Vadillo nº 9,2
Fuente neoclásica en la avenida de Oporto,Monuments,Avda Oporto ,212 - Marqués de Vadillo,Glorieta Marqués de Vadillo nº 9,2
Fuentes en la vía Lusitana,Monuments,C Faro ,212 - Marqués de Vadillo,Glorieta Marqués de Vadillo nº 9,2
Fuentes en la vía Lusitana,Monuments,C Juan Ramón Carrero ,212 - Marqués de Vadillo,Glorieta Marqués de Vadillo nº 9,2
Fuente en la calle Vía Lusitana,Monuments,Avda Vía Lusitana ,212 - Marqués de Vadillo,Glorieta Marqués de Vadillo nº 9,2
Fuente del parque Emperatriz María de Austria,Monuments,Avda Vía Lusitana ,212 - Marqués de Vadillo,Glorieta Marqués de Vadillo nº 9,2
El buzón de las palabras,Monuments,Pza Carabanchel ,212 - Marqués de Vadillo,Glorieta Marqués de Vadillo nº 9,2
Puerta Bonita,Monuments,C General Ricardos ,212 - Marqués de Vadillo,Glorieta Marqués de Vadillo nº 9,2
Fuente en la calle del Euro,Monuments,Avda Euro ,212 - Marqués de Vadillo,Glorieta Marqués de Vadillo nº 9,2
Fuente Vía Lusitana,Monuments,Avda Vía Lusitana ,212 - Marqués de Vadillo,Glorieta Marqués de Vadillo nº 9,2
Pérgola calle del Euro,Monuments,Avda Euro ,212 - Marqués de Vadillo,Glorieta Marqués de Vadillo nº 9,2
Ría Colegio Las Acacias,Monuments,C General Ricardos 179,212 - Marqués de Vadillo,Glorieta Marqués de Vadillo nº 9,2
Fray Pedro Ponce de León,Monuments,Avda Eduardo Barreiros 6,213 - Glorieta de Cádiz,Calle Antonio López nº 129,18
Fuente circular del Instituto Ponce de León,Monuments,Avda Eduardo Barreiros 6,213 - Glorieta de Cádiz,Calle Antonio López nº 129,18
Al Viejo Profesor,Monuments,Avda Eduardo Barreiros 17,213 - Glorieta de Cádiz,Calle Antonio López nº 129,18
Ciudad Sanitaria 12 Octubre,Monuments,Avda Córdoba ,213 - Glorieta de Cádiz,Calle Antonio López nº 129,18
Imprenta,Monuments,Avda Eduardo Barreiros 6,213 - Glorieta de Cádiz,Calle Antonio López nº 129,18
Arturo Pajuelo Rubio,Monuments,Pza Sestao ,213 - Glorieta de Cádiz,Calle Antonio López nº 129,18
La Fuente,Monuments,Pza Asociación ,213 - Glorieta de Cádiz,Calle Antonio López nº 129,18
Niños en el Colegio Público Marcelo Usera,Monuments,C Perales de Tajuña 1,213 - Glorieta de Cádiz,Calle Antonio López nº 129,18
Estanque de Pradolongo,Monuments,PARQUE PRADOLONGO ,213 - Glorieta de Cádiz,Calle Antonio López nº 129,18
Fuentes avenida de los Poblados-Rafaela Ybarra,Monuments,Avda Poblados ,213 - Glorieta de Cádiz,Calle Antonio López nº 129,18
Estanque Rafaela Ybarra,Monuments,Avda Rafaela Ybarra ,213 - Glorieta de Cádiz,Calle Antonio López nº 129,18
Estanque semicircular y canal Pradolongo,Monuments,PARQUE PRADOLONGO ,213 - Glorieta de Cádiz,Calle Antonio López nº 129,18
Fuente circular I del parque de Pradolongo,Monuments, ,213 - Glorieta de Cádiz,Calle Antonio López nº 129,18
Fuente circular II del parque de Pradolongo,Monuments, ,213 - Glorieta de Cádiz,Calle Antonio López nº 129,18
Fuente circular III del parque de Pradolongo,Monuments,PARQUE PRADOLONGO ,213 - Glorieta de Cádiz,Calle Antonio López nº 129,18
Venus emergiendo de las aguas,Monuments, ,213 - Glorieta de Cádiz,Calle Antonio López nº 129,18
Fuente circular del parque de Pradolongo,Monuments,PARQUE PRADOLONGO ,213 - Glorieta de Cádiz,Calle Antonio López nº 129,18
Columnas toscanas Pradolongo,Monuments,PARQUE PRADOLONGO ,213 - Glorieta de Cádiz,Calle Antonio López nº 129,18
Monolito Unidad Pozo-Orcasitas,Monuments,Pza Asociación s/n,213 - Glorieta de Cádiz,Calle Antonio López nº 129,18
Monolito del parque de Pradolongo,Monuments, ,213 - Glorieta de Cádiz,Calle Antonio López nº 129,18
Enrique Tierno Galván,Monuments,C Arroyo Bueno 53,213 - Glorieta de Cádiz,Calle Antonio López nº 129,18
Escultura en chapa metálica en la calle San Jenaro,Monuments,C San Jenaro ,213 - Glorieta de Cádiz,Calle Antonio López nº 129,18
Fuente del parque Ciudad de los Ángeles,Monuments, ,213 - Glorieta de Cádiz,Calle Antonio López nº 129,18
Fuente con escultura en la calle San Jenaro,Monuments,C San Jenaro ,213 - Glorieta de Cádiz,Calle Antonio López nº 129,18
Fuente octogonal de la plaza Ágata I,Monuments,Pza Ágata ,213 - Glorieta de Cádiz,Calle Antonio López nº 129,18
Fuente octogonal de la plaza Ágata II,Monuments,Pza Ágata ,213 - Glorieta de Cádiz,Calle Antonio López nº 129,18
Fuente de la Piña en Villaverde,Monuments,CALLE ALCARRIA ,213 - Glorieta de Cádiz,Calle Antonio López nº 129,18
Fuente plaza Ágata,Monuments,Pza Ágata ,213 - Glorieta de Cádiz,Calle Antonio López nº 129,18
Centro Básico de Servicios Sociales y 3ª Edad,Monuments,C Villalonso 12,213 - Glorieta de Cádiz,Calle Antonio López nº 129,18
Centro Cultural Ágata,Monuments,Pza Ágata 2,213 - Glorieta de Cádiz,Calle Antonio López nº 129,18
Puerta de la Alcarria,Monuments,C Alcarria ,213 - Glorieta de Cádiz,Calle Antonio López nº 129,18
Fuente ornamental Mirasierra-Amparo Usera,Monuments,C Amparo Usera ,213 - Glorieta de Cádiz,Calle Antonio López nº 129,18
La Gloria,Monuments,Gta Cádiz ,213 - Glorieta de Cádiz,Calle Antonio López nº 129,18
Monolito jardines de Cándido Reyes,Monuments,Avda Poblados 154,213 - Glorieta de Cádiz,Calle Antonio López nº 129,18
Fuente circular en la calle Almendrales,Monuments,C Almendrales ,213 - Glorieta de Cádiz,Calle Antonio López nº 129,18
Fuente Meseta de Orcasitas,Monuments,Avda Rafaela Ybarra 101,213 - Glorieta de Cádiz,Calle Antonio López nº 129,18
Monolito Marcelo Usera,Monuments,C Marcelo Usera 50,213 - Glorieta de Cádiz,Calle Antonio López nº 129,18
David González Rubio I,Monuments,C Doctor Tolosa Latour ,213 - Glorieta de Cádiz,Calle Antonio López nº 129,18
Umbráculo del Parque del Manzanares,Monuments,CAMINO PERALES ,213 - Glorieta de Cádiz,Calle Antonio López nº 129,18
Fuente del parque del Manzanares,Monuments,CAMINO PERALES 1,213 - Glorieta de Cádiz,Calle Antonio López nº 129,18
Monumento 1 Gran Vía Villaverde Letras,Monuments,C Gran Vía de Villaverde ,213 - Glorieta de Cádiz,Calle Antonio López nº 129,18
Monumento 2 Gran Vía Villaverde,Monuments,AVENIDA GRAN VIA DE VILLAVERDE 20,213 - Glorieta de Cádiz,Calle Antonio López nº 129,18
Monumento 3 Gran Vía Villaverde,Monuments,AVENIDA GRAN VIA DE VILLAVERDE 20,213 - Glorieta de Cádiz,Calle Antonio López nº 129,18
Templete Meseta de Orcasitas,Monuments,Avda Rafaela Ybarra 101,213 - Glorieta de Cádiz,Calle Antonio López nº 129,18
Grupo escultórico mujer y tortuga,Monuments,Pº Alberto Palacios 1,213 - Glorieta de Cádiz,Calle Antonio López nº 129,18
Esculturas emergentes Pradolongo,Monuments,C Doctor Tolosa Latour ,213 - Glorieta de Cádiz,Calle Antonio López nº 129,18
Banda en los círculos,Monuments, ,213 - Glorieta de Cádiz,Calle Antonio López nº 129,18
Maternidad,Monuments,C Cestona 5,213 - Glorieta de Cádiz,Calle Antonio López nº 129,18
David González Rubio II,Monuments,C Doctor Tolosa Latour ,213 - Glorieta de Cádiz,Calle Antonio López nº 129,18
Estanques rectangulares Pradolongo,Monuments, ,213 - Glorieta de Cádiz,Calle Antonio López nº 129,18
Placa Matadero en Usera,Monuments,"Avda Manzanares, del 212",213 - Glorieta de Cádiz,Calle Antonio López nº 129,18
Linotipia,Monuments,Avda Eduardo Barreiros 6,213 - Glorieta de Cádiz,Calle Antonio López nº 129,18
Escultura con material de desecho,Monuments,Avda Eduardo Barreiros 6,213 - Glorieta de Cádiz,Calle Antonio López nº 129,18
Estanque Centro de Informática Seg. Social,Monuments,CALLE DOCTOR TOLOSA LATOUR 7,213 - Glorieta de Cádiz,Calle Antonio López nº 129,18
Escultura monolítica I Inst. Prof. de Sordomudos Ponce de León,Monuments,Avda Eduardo Barreiros 6,213 - Glorieta de Cádiz,Calle Antonio López nº 129,18
Escultura monolítica II Inst. Prof. de Sordomudos Ponce de León,Monuments,Avda Eduardo Barreiros 6,213 - Glorieta de Cádiz,Calle Antonio López nº 129,18
Virgen de la Misericordia,Monuments,C Arroyo del Olivar 100,227 - Concordia,Calle Arroyo del Olivar nº 6,21
Grupo escultórico C. Especialidades V. Soldevilla I,Monuments,C Sierra de Alquife 8,227 - Concordia,Calle Arroyo del Olivar nº 6,21
Grupo escultórico C. Especialidades V. Soldevilla II,Monuments,CALLE SIERRA DE ALQUIFE 8,227 - Concordia,Calle Arroyo del Olivar nº 6,21
Amós Acero,Monuments, ,227 - Concordia,Calle Arroyo del Olivar nº 6,21
Figura femenina,Monuments,Trav Felipe de Diego 20,227 - Concordia,Calle Arroyo del Olivar nº 6,21
Familia,Monuments,Trav Felipe de Diego ,227 - Concordia,Calle Arroyo del Olivar nº 6,21
Geometría Natural,Monuments,C Sierra de Molina ,227 - Concordia,Calle Arroyo del Olivar nº 6,21
Diana,Monuments,Trav Felipe de Diego ,227 - Concordia,Calle Arroyo del Olivar nº 6,21
Homenaje a Goya - La Maja desnuda,Monuments,Trav Felipe de Diego 19,227 - Concordia,Calle Arroyo del Olivar nº 6,21
A Neruda-El Ser alado,Monuments,Gta José Luis Ozores 116,227 - Concordia,Calle Arroyo del Olivar nº 6,21
Oso y Madroño,Monuments,C Barros 16,227 - Concordia,Calle Arroyo del Olivar nº 6,21
Un Personaje Importante,Monuments,Trav Felipe de Diego ,227 - Concordia,Calle Arroyo del Olivar nº 6,21
Fuente circular del parque Amós Acero,Monuments, ,227 - Concordia,Calle Arroyo del Olivar nº 6,21
Víctimas Ayuntamiento de Vallecas,Monuments,Avda Albufera 42,227 - Concordia,Calle Arroyo del Olivar nº 6,21
Mosaico mural,Monuments,Trav Felipe de Diego ,227 - Concordia,Calle Arroyo del Olivar nº 6,21
Paneles cerámicos vidriados. Palomeras bajas,Monuments,CALLE AHIJONES 1,227 - Concordia,Calle Arroyo del Olivar nº 6,21
Unidad vecinal Nº 5 Entrevías,Monuments,C Cazorla ,227 - Concordia,Calle Arroyo del Olivar nº 6,21
Fuente de Mercamadrid,Monuments,Me Mercado Mercamadrid ,227 - Concordia,Calle Arroyo del Olivar nº 6,21
Mercamadrid,Monuments,Me Mercado Mercamadrid ,227 - Concordia,Calle Arroyo del Olivar nº 6,21
José Luis Pinto Álvarez,Monuments,Me Mercado Mercamadrid ,227 - Concordia,Calle Arroyo del Olivar nº 6,21
Padre Llanos,Monuments,C Cooperativa Eléctrica ,227 - Concordia,Calle Arroyo del Olivar nº 6,21
Fuente de la Asamblea de Madrid,Monuments,Pza Asamblea de Madrid ,227 - Concordia,Calle Arroyo del Olivar nº 6,21
La Abuela rockera-Ángeles Rodríguez Hidalgo,Monuments,C Peña Gorbea ,227 - Concordia,Calle Arroyo del Olivar nº 6,21
Fuente en la calle Arroyo del Olivar,Monuments,C Arroyo del Olivar ,227 - Concordia,Calle Arroyo del Olivar nº 6,21
Homenaje a García Lorca - Arco en el pentágono,Monuments,C Puerto del Milagro ,227 - Concordia,Calle Arroyo del Olivar nº 6,21
Fuente en la avenida de las Glorietas,Monuments,C Esteban Carros ,227 - Concordia,Calle Arroyo del Olivar nº 6,21
Plano de Entrevías,Monuments,Avda Entrevías 52,227 - Concordia,Calle Arroyo del Olivar nº 6,21
Fuente mural del parque Fofó,Monuments, ,227 - Concordia,Calle Arroyo del Olivar nº 6,21
Fuente Pablo Neruda I,Monuments,Avda Pablo Neruda 112,227 - Concordia,Calle Arroyo del Olivar nº 6,21
Fuente Pablo Neruda II,Monuments,AVENIDA PABLO NERUDA 114,227 - Concordia,Calle Arroyo del Olivar nº 6,21
Fuente en la estación Asamblea de Madrid I,Monuments,Avda Entrevías s/n,227 - Concordia,Calle Arroyo del Olivar nº 6,21
Fuente en la estación Asamblea de Madrid II,Monuments,Avda Entrevías ,227 - Concordia,Calle Arroyo del Olivar nº 6,21
Fuente en la estación Asamblea de Madrid III,Monuments,Avda Entrevías s/n,227 - Concordia,Calle Arroyo del Olivar nº 6,21
Fuente en la estación Asamblea de Madrid IV,Monuments,Avda Entrevías s/n,227 - Concordia,Calle Arroyo del Olivar nº 6,21
Fuente en la estación Asamblea de Madrid V,Monuments,Avda Entrevías s/n,227 - Concordia,Calle Arroyo del Olivar nº 6,21
Monumento a las víctimas del 11-M El Pozo,Monuments,Avda Entrevías ,227 - Concordia,Calle Arroyo del Olivar nº 6,21
Orden cósmico,Monuments,Trav Felipe de Diego s/n,227 - Concordia,Calle Arroyo del Olivar nº 6,21
Juan Carlos I,Monuments,Avda Pablo Neruda 142,227 - Concordia,Calle Arroyo del Olivar nº 6,21
Placa inauguración Asamblea de Madrid,Monuments,Avda Pablo Neruda 142,227 - Concordia,Calle Arroyo del Olivar nº 6,21
Encuentro en la playa,Monuments,Trav Felipe de Diego 2,227 - Concordia,Calle Arroyo del Olivar nº 6,21
Carlos María Rodríguez de Valcárcel,Monuments,Pza Encuentro 4,220 - Plaza del Encuentro,Calle Arroyo de las Pilillas nº 6,16
Fuente semicircular Pinos,Monuments,PARQUE PINOS ,220 - Plaza del Encuentro,Calle Arroyo de las Pilillas nº 6,16
Burrito,Monuments,C Pío Felipe 12,220 - Plaza del Encuentro,Calle Arroyo de las Pilillas nº 6,16
Eos,Monuments,C Las Marismas 25,220 - Plaza del Encuentro,Calle Arroyo de las Pilillas nº 6,16
Hypnos,Monuments,C Las Marismas 41,220 - Plaza del Encuentro,Calle Arroyo de las Pilillas nº 6,16
Escudo de Madrid,Monuments,Pza Encuentro ,220 - Plaza del Encuentro,Calle Arroyo de las Pilillas nº 6,16
Sagrado Corazón de Jesús,Monuments,CALLE ARTURO SORIA 101,230 - Carlota O’Neill,Calle Carlota O'Neill nº 32,13
Ad Iesum per Mariam,Monuments,AVENIDA MACHUPICHU 1,230 - Carlota O’Neill,Calle Carlota O'Neill nº 32,13
Escultura AENA,Monuments,C Arturo Soria 109,230 - Carlota O’Neill,Calle Carlota O'Neill nº 32,13
Cinco obeliscos Centro Comercial Arturo Soria Plaza,Monuments,C Arturo Soria 126,230 - Carlota O’Neill,Calle Carlota O'Neill nº 32,13
San José,Monuments,C Mar Adriático 11,230 - Carlota O’Neill,Calle Carlota O'Neill nº 32,13
Arturo Soria y Mata,Monuments,C Arturo Soria ,230 - Carlota O’Neill,Calle Carlota O'Neill nº 32,13
Fauna Mayor Ibérica I,Monuments,C Arturo Soria ,230 - Carlota O’Neill,Calle Carlota O'Neill nº 32,13
Fauna Mayor Ibérica II,Monuments,C Arturo Soria 101,230 - Carlota O’Neill,Calle Carlota O'Neill nº 32,13
Estanque Arturo Soria I,Monuments,C Arturo Soria 36,230 - Carlota O’Neill,Calle Carlota O'Neill nº 32,13
Estanque Arturo Soria II,Monuments,C Arturo Soria 118,230 - Carlota O’Neill,Calle Carlota O'Neill nº 32,13
Dedos,Monuments,PARQUE JUAN CARLOS I 1,230 - Carlota O’Neill,Calle Carlota O'Neill nº 32,13
Reina Sofía,Monuments,Ctra Canillas 51,230 - Carlota O’Neill,Calle Carlota O'Neill nº 32,13
Escultura abstracta en la calle Pedroñeras,Monuments,C Pedroñeras 31,230 - Carlota O’Neill,Calle Carlota O'Neill nº 32,13
Fuente del parque Villarrosa,Monuments,C Aconcagua ,230 - Carlota O’Neill,Calle Carlota O'Neill nº 32,13
Fuente de los caballitos de Hortaleza,Monuments,C Mar Amarillo ,230 - Carlota O’Neill,Calle Carlota O'Neill nº 32,13
Fuente mural del parque Isabel Clara Eugenia,Monuments, ,230 - Carlota O’Neill,Calle Carlota O'Neill nº 32,13
Estanque parque Huerta de la Salud,Monuments, ,230 - Carlota O’Neill,Calle Carlota O'Neill nº 32,13
Estanque escalonado Pinar del Rey,Monuments,C Macuaje ,230 - Carlota O’Neill,Calle Carlota O'Neill nº 32,13
Ría y estanque Villarrosa,Monuments,C Aconcagua ,230 - Carlota O’Neill,Calle Carlota O'Neill nº 32,13
Centro de Educación Especial Reina Sofía,Monuments,Ctra Canillas 51,230 - Carlota O’Neill,Calle Carlota O'Neill nº 32,13
Colegio Público Dionisio Ridruejo,Monuments,C Zipaquira 14,230 - Carlota O’Neill,Calle Carlota O'Neill nº 32,13
Plaza de la Unión Cárcavas-San Antonio,Monuments,Pza Unión Cárcavas-San Antonio ,230 - Carlota O’Neill,Calle Carlota O'Neill nº 32,13
Mariano Martínez López (actualmente desaparecida),Monuments,Pza Unión Cárcavas-San Antonio ,230 - Carlota O’Neill,Calle Carlota O'Neill nº 32,13
Monolito conmemorativo del parque Villarrosa,Monuments,C Pedroñeras ,230 - Carlota O’Neill,Calle Carlota O'Neill nº 32,13
Pilar IV,Monuments,C Mar de las Antillas 1,230 - Carlota O’Neill,Calle Carlota O'Neill nº 32,13
Monumento a Enrique Tierno Galván,Monuments,C Aconcagua ,230 - Carlota O’Neill,Calle Carlota O'Neill nº 32,13
Reloj solar,Monuments,C Aconcagua ,230 - Carlota O’Neill,Calle Carlota O'Neill nº 32,13
Templete Villarrosa,Monuments,C Aconcagua ,230 - Carlota O’Neill,Calle Carlota O'Neill nº 32,13
Estanque alto del parque en la Quinta de los Molinos,Monuments,C Alcalá 527,230 - Carlota O’Neill,Calle Carlota O'Neill nº 32,13
Dos estanques rectangulares en la calle Alcalá,Monuments,C Alcalá 527,230 - Carlota O’Neill,Calle Carlota O'Neill nº 32,13
Fuente con cuatro tazas de la Quinta de los Molinos,Monuments,C Alcalá 527,230 - Carlota O’Neill,Calle Carlota O'Neill nº 32,13
Árbol de la Vida,Monuments,JARDIN TRES CULTURAS ,230 - Carlota O’Neill,Calle Carlota O'Neill nº 32,13
Eolos,Monuments,PARQUE JUAN CARLOS I 1,230 - Carlota O’Neill,Calle Carlota O'Neill nº 32,13
Espacio México,Monuments,PARQUE JUAN CARLOS I 1,230 - Carlota O’Neill,Calle Carlota O'Neill nº 32,13
Fisicromía para Madrid,Monuments,PARQUE JUAN CARLOS I 1,230 - Carlota O’Neill,Calle Carlota O'Neill nº 32,13
Manolona Opus 397,Monuments, ,230 - Carlota O’Neill,Calle Carlota O'Neill nº 32,13
Don Juan de Borbón,Monuments,Gta Su Alteza Real Don Juan de Borbón y Battemberg ,230 - Carlota O’Neill,Calle Carlota O'Neill nº 32,13
Monumento a la Paz,Monuments, ,230 - Carlota O’Neill,Calle Carlota O'Neill nº 32,13
Viga,Monuments, ,230 - Carlota O’Neill,Calle Carlota O'Neill nº 32,13
Canal del parque Juan Carlos I,Monuments, ,230 - Carlota O’Neill,Calle Carlota O'Neill nº 32,13
Cuatro Ríos,Monuments,JARDIN TRES CULTURAS ,230 - Carlota O’Neill,Calle Carlota O'Neill nº 32,13
Estanque plaza del Recibimiento,Monuments, ,230 - Carlota O’Neill,Calle Carlota O'Neill nº 32,13
Estanque I Campo de las Naciones,Monuments,"Avda Capital de España, Madrid ",230 - Carlota O’Neill,Calle Carlota O'Neill nº 32,13
Estanque II Campo de las Naciones,Monuments,"Avda Capital de España, Madrid ",230 - Carlota O’Neill,Calle Carlota O'Neill nº 32,13
Estanque III Campo de las Naciones,Monuments,"Avda Capital de España, Madrid ",230 - Carlota O’Neill,Calle Carlota O'Neill nº 32,13
Estanque jardín Judío,Monuments,JARDIN TRES CULTURAS ,230 - Carlota O’Neill,Calle Carlota O'Neill nº 32,13
Estanque norte del parque Juan Carlos I,Monuments,PARQUE JUAN CARLOS I 1,230 - Carlota O’Neill,Calle Carlota O'Neill nº 32,13
Estanque paseo Central,Monuments, ,230 - Carlota O’Neill,Calle Carlota O'Neill nº 32,13
Estanque sur del parque Juan Carlos I,Monuments,PARQUE JUAN CARLOS I 1,230 - Carlota O’Neill,Calle Carlota O'Neill nº 32,13
Fuente cibernética D. Juan de Bórbón,Monuments,Gta Su Alteza Real Don Juan de Borbón y Battemberg ,230 - Carlota O’Neill,Calle Carlota O'Neill nº 32,13
Fuente de mármol del jardín de las Tres Culturas,Monuments,JARDIN TRES CULTURAS ,230 - Carlota O’Neill,Calle Carlota O'Neill nº 32,13
Albercas-acequias del Jardín Islámico,Monuments,JARDIN TRES CULTURAS ,230 - Carlota O’Neill,Calle Carlota O'Neill nº 32,13
Lámina de agua en cascada,Monuments, ,230 - Carlota O’Neill,Calle Carlota O'Neill nº 32,13
Nubes Cromáticas,Monuments, ,230 - Carlota O’Neill,Calle Carlota O'Neill nº 32,13
Estanques-graderíos,Monuments,JARDIN TRES CULTURAS ,230 - Carlota O’Neill,Calle Carlota O'Neill nº 32,13
Parque Juan Carlos I,Monuments, ,230 - Carlota O’Neill,Calle Carlota O'Neill nº 32,13
Columnata del claustro,Monuments,JARDIN TRES CULTURAS ,230 - Carlota O’Neill,Calle Carlota O'Neill nº 32,13
Pilastras hitos plaza Recibimiento,Monuments, ,230 - Carlota O’Neill,Calle Carlota O'Neill nº 32,13
Pórtico principal,Monuments, ,230 - Carlota O’Neill,Calle Carlota O'Neill nº 32,13
Melvin Jones,Monuments,"Avda Capital de España, Madrid ",230 - Carlota O’Neill,Calle Carlota O'Neill nº 32,13
Fuente del Liceo,Monuments,Pza Liceo ,230 - Carlota O’Neill,Calle Carlota O'Neill nº 32,13
Encuentros,Monuments, ,230 - Carlota O’Neill,Calle Carlota O'Neill nº 32,13
Puerta Huerta de la Salud,Monuments,C Mar de las Antillas 6,230 - Carlota O’Neill,Calle Carlota O'Neill nº 32,13
Fuente en la calle Condesa de Venadito,Monuments,C Condesa de Venadito 11,230 - Carlota O’Neill,Calle Carlota O'Neill nº 32,13
Fuente Sandro Pertini,Monuments,Gta Sandro Pertini ,230 - Carlota O’Neill,Calle Carlota O'Neill nº 32,13
Escultura en la plaza Santos de la Humosa,Monuments,Plaza Santos de la Humosa ,230 - Carlota O’Neill,Calle Carlota O'Neill nº 32,13
Fuente de la glorieta de Luxemburgo,Monuments,Gta Luxemburgo ,230 - Carlota O’Neill,Calle Carlota O'Neill nº 32,13
Fuente en la glorieta de Hamburgo,Monuments,Gta Hamburgo ,230 - Carlota O’Neill,Calle Carlota O'Neill nº 32,13
Fuente plaza José María Escrivá de Balaguer,Monuments,Pza José María Escrivá de Balaguer ,230 - Carlota O’Neill,Calle Carlota O'Neill nº 32,13
Vela,Monuments,C Ribera del Sena ,230 - Carlota O’Neill,Calle Carlota O'Neill nº 32,13
Fuente Sena I,Monuments,C Ribera del Sena ,230 - Carlota O’Neill,Calle Carlota O'Neill nº 32,13
Fuente Sena II,Monuments,C Ribera del Sena ,230 - Carlota O’Neill,Calle Carlota O'Neill nº 32,13
Monolito calle Baterías,Monuments,CALLE BATERIAS 9,230 - Carlota O’Neill,Calle Carlota O'Neill nº 32,13
Fuente en la calle Batería,Monuments,CALLE BATERIAS 9,230 - Carlota O’Neill,Calle Carlota O'Neill nº 32,13
A las víctimas del Holocausto,Monuments,JARDIN TRES CULTURAS ,230 - Carlota O’Neill,Calle Carlota O'Neill nº 32,13
Resto escultóricos y arquitectónicos,Monuments, ,230 - Carlota O’Neill,Calle Carlota O'Neill nº 32,13
Foro-patio del parque Clara Eugenia,Monuments, ,230 - Carlota O’Neill,Calle Carlota O'Neill nº 32,13
Escultura abstracta del Edificio BBVA,Monuments,Vía Los Poblados s/n,230 - Carlota O’Neill,Calle Carlota O'Neill nº 32,13
Villa Rotonda,Monuments,C Aconcagua ,230 - Carlota O’Neill,Calle Carlota O'Neill nº 32,13
Nuestra Señora de los Desamparados,Monuments,Pza Pinazo 9,235 - Embajadores 191,Calle Sodio nº 1B,11
Colegiales,Monuments,Pza Pinazo 7,235 - Embajadores 191,Calle Sodio nº 1B,11
Paloma de la Paz,Monuments,Pza Paloma de la Paz 1,235 - Embajadores 191,Calle Sodio nº 1B,11
Estanque C. Cultural S. Cristóbal,Monuments,Pza Pinazo 9,235 - Embajadores 191,Calle Sodio nº 1B,11
Estanque Dehesa Boyal,Monuments,PARQUE DEHESA BOYAL ,235 - Embajadores 191,Calle Sodio nº 1B,11
Fuente de la Capona,Monuments,C Fuente de la Capona ,235 - Embajadores 191,Calle Sodio nº 1B,11
Fuente del parque de El Espinillo,Monuments, ,235 - Embajadores 191,Calle Sodio nº 1B,11
Centro Cultural San Cristóbal de los Ángeles,Monuments,Pza Pinazo 9,235 - Embajadores 191,Calle Sodio nº 1B,11
Enrique Tierno Galván,Monuments, ,235 - Embajadores 191,Calle Sodio nº 1B,11
Restos de fábrica de ladrillos Norah,Monuments, ,235 - Embajadores 191,Calle Sodio nº 1B,11
Homenaje a Pío Baroja,Monuments,Avda Andalucía ,235 - Embajadores 191,Calle Sodio nº 1B,11
Fuente en la plaza Chozas de Canales,Monuments,Pza Chozas de Canales ,235 - Embajadores 191,Calle Sodio nº 1B,11
Ruinas parque del Espinillo,Monuments, ,235 - Embajadores 191,Calle Sodio nº 1B,11
Fuente en la avenida de la Felicidad,Monuments,Avda Felicidad ,235 - Embajadores 191,Calle Sodio nº 1B,11
Fuente Pilar Lorengar,Monuments,C Pilar Lorengar 19,235 - Embajadores 191,Calle Sodio nº 1B,11
